uri,cid,text,created_at,reply_count,repost_count,like_count,indexed_at,author_handle,author_display_name,author_did
at://did:plc:wkdrycec5nz3fe7a6pwp6kms/app.bsky.feed.post/3l3wk5atj3v2b,bafyreic7ivyvhsofo5sli6pgsk6y73d555ixqasptsb6wenzpcaid72mqe,"Primeiro tem que chegar ao segundo turno, com 8% só um milagre, não chega e ainda impede Boulos",2024-09-12T03:51:44.200Z,0,0,0,2024-09-12T03:51:44.200Z,tadeusouza.bsky.social,Tady,did:plc:wkdrycec5nz3fe7a6pwp6kms
at://did:plc:spvnojyysev4cy65uqbjys45/app.bsky.feed.post/3l3vhein3bw2n,bafyreidxjfewsxlsymoyh36atjwffesvq6ctm7t7e5e66dibw3y54dl5eq,bsky.app/profile/anit...,2024-09-11T17:29:26.309Z,1,1,2,2024-09-11T17:29:26.309Z,anitablian.bsky.social,Rogério Anitablian,did:plc:spvnojyysev4cy65uqbjys45
at://did:plc:rdp4e6uyn56sjm3krykz7chm/app.bsky.feed.post/3l3vfkwyxlh26,bafyreifkrkldpiu5h3sypmga754p3rlhvm2yhqjcf7ke5ccup2hn6276pu,*O Instituto Atlas Intel entrevistou 2.200 eleitores por meio de recrutamento digital entre os dias 5 e 10 de setembro. A pesquisa foi registrada no Tribunal Superior Eleitoral (TSE) sob o Protocolo SP-01125/2024.,2024-09-11T16:57:15.473Z,3,1,14,2024-09-11T16:57:15.425Z,tabatasp.bsky.social,Tabata Amaral 40,did:plc:rdp4e6uyn56sjm3krykz7chm
at://did:plc:n2cc2uhxmud4bfbjs6zitvsa/app.bsky.feed.post/3l3vy4fd7oo2n,bafyreigioszifpxbbf7o2et3cdjd2jlsufm2byawiadtq7cksexavilsee,"falam que você traiu os trabalhadores e tem Marta Suplicy como vice 😂😂😂😂
2016 foi ontem, está guardado na memória!",2024-09-11T22:29:07.520Z,0,0,0,2024-09-11T22:29:07.520Z,passolargo01.bsky.social,MauMau ,did:plc:n2cc2uhxmud4bfbjs6zitvsa
at://did:plc:ibhftvknxm2tph3tr7h5kvet/app.bsky.feed.post/3l3vftudwv42l,bafyreicctr6kprsadgoaemm33ehtfkaans3zi42yvghw6f3c37nijpdqyy,"Sublime Deputada, você é a minha política favorita 📚🏆👏",2024-09-11T17:02:14.334Z,0,0,1,2024-09-11T17:02:14.334Z,marcelomeira.bsky.social,,did:plc:ibhftvknxm2tph3tr7h5kvet
at://did:plc:frrzudiryqjo6trlndb3ivkj/app.bsky.feed.post/3l3x6ia4tdo2b,bafyreibndjgjaopy656vtrvbk5m4or3ni6oiwbbavwqxstznp2shmndiri,O problema é chegar no segundo turno. Talvez a única chance é explorar as fraquezas de cada um para tirar votos deles para você.,2024-09-12T09:55:47.717Z,0,0,0,2024-09-12T09:55:47.610Z,franz-josefh.bsky.social,Franz Josef,did:plc:frrzudiryqjo6trlndb3ivkj
at://did:plc:36q2jtd7byzxgquhvwmx5mgk/app.bsky.feed.post/3l42ntawx4r2g,bafyreid36dfjiopbjbmdubqiyn2gni7mcqnogjpsvuk35rr5rs5jp2mkra,A soberba precede a queda,2024-09-13T19:08:22.663Z,0,0,0,2024-09-13T19:08:22.663Z,quasehenrique.bsky.social,Henrique  ◤✠◢  ¹⁸⁹⁸,did:plc:36q2jtd7byzxgquhvwmx5mgk
at://did:plc:z2kpjn33q4ugzeanrvxen7py/app.bsky.feed.post/3l3vaeteajq2y,bafyreidqp7z354euxoqcfzm5xvxfbq2tkktbq7ah4gcjx5buabmsbhyjwe,Nenhuma política ou projeto seu chegou aos professores de MG. Sabe o que chegou? A reforma da previdência que coloca professores com mais de 60 anos nas salas de aula,2024-09-11T15:24:21.323Z,1,0,0,2024-09-11T15:24:21.323Z,profalessandro.bsky.social,Prof. Me.  Alessandro ,did:plc:z2kpjn33q4ugzeanrvxen7py
at://did:plc:xobd3w36xlar4y75r4v7qakq/app.bsky.feed.post/3l3vw2dl5ba26,bafyreicrvy7vhkdqmmgo2wpjq7tgqdgup55r4xwnfxyszquoss2x2hwydq,"ALÔ TABATA!
DESISTA E APOIE BOULOS!
FAÇA ESSE GESTO DE SABEDORIA E HUMILDADE",2024-09-11T13:28:42.040Z,0,0,0,2024-09-11T13:28:42.040Z,punkspunk.bsky.social,,did:plc:xobd3w36xlar4y75r4v7qakq
at://did:plc:spvnojyysev4cy65uqbjys45/app.bsky.feed.post/3l3vdsxb4eu2t,bafyreihlukpe4rqiakudirg2rnc5zcawdi4o5iviwzxii4dp7rydshdrr4,bsky.app/profile/anit...,2024-09-11T16:25:56.411Z,0,0,0,2024-09-11T16:25:56.411Z,anitablian.bsky.social,Rogério Anitablian,did:plc:spvnojyysev4cy65uqbjys45
at://did:plc:oox2ool7g4f2hpttarw5xyvy/app.bsky.feed.post/3l3vaalcuus22,bafyreiaandg3chlmmqa4afuw2oxerxiwbp2frhdf6x35tbfpu7llxs35ue,👏🏻👏🏻👏🏻,2024-09-11T15:21:58.335Z,0,0,1,2024-09-11T15:21:58.335Z,matheusbarretto.bsky.social,Patricinha amarga ,did:plc:oox2ool7g4f2hpttarw5xyvy
at://did:plc:aggw27igv63fmu2nc6usyeo3/app.bsky.feed.post/3l3vd44jrlz2n,bafyreiclucwmmfjzueumfce3erbrwxqfgbgirg4ttjbkv2bsohhkey2fem,Poucas vezes vi uma política tão competente.,2024-09-11T16:13:09.234Z,0,0,0,2024-09-11T16:13:09.234Z,leonardo1982.bsky.social,Leonardo ,did:plc:aggw27igv63fmu2nc6usyeo3
at://did:plc:4eoehni7aous6ok5murv32zy/app.bsky.feed.post/3l3vac354og2h,bafyreidpqqt7mtbkegempt3d6avbrrgak4paozgcpp663pw56nbrotrwhu,👏,2024-09-11T15:22:47.440Z,0,0,1,2024-09-11T15:22:47.440Z,marciobrasil.bsky.social,Márcio Brasil 💠,did:plc:4eoehni7aous6ok5murv32zy
at://did:plc:qsdxa2seukvw2ecjcmcxwq2i/app.bsky.feed.post/3l3tlr5xibn2o,bafyreidzccyhq6fvvy6k4kikw5y3ph6dirj2nt5k2wovuv62o7sijcephm,Força!,2024-09-10T23:42:46.768Z,0,0,0,2024-09-10T23:42:46.768Z,jukiri.bsky.social,Jukiri,did:plc:qsdxa2seukvw2ecjcmcxwq2i
at://did:plc:pikt5agmqhrytohkbu3v3mnh/app.bsky.feed.post/3l3tlb5hjyy2z,bafyreiho3bgism35n2c66tcvn5mnvws2qoedobianxe4y7v5qsd6xwr7ym,Salva nois,2024-09-10T23:33:49.164Z,0,0,0,2024-09-10T23:33:49.164Z,cantorfumante.bsky.social,cantorfumante,did:plc:pikt5agmqhrytohkbu3v3mnh
at://did:plc:mbylr6tjwnangpuvi6njpqaq/app.bsky.feed.post/3l3tm2zxjk62q,bafyreigeew4oh5kbwuza6dy3k4rlqxxcdk5klb77i4osve4kje5uccz7uu,Nossa Deus proteja não consigo salvar meus relacionamentos mas to com vc,2024-09-10T23:48:18.064Z,0,0,0,2024-09-10T23:48:18.064Z,madammorgana.bsky.social,,did:plc:mbylr6tjwnangpuvi6njpqaq
at://did:plc:fwd7q3qadqdotqlkmg2z7c3b/app.bsky.feed.post/3l3txhnvtst2y,bafyreihjow5avwavdtdysdlgo277q4ulaceuu6x7aysm6ii577tkzohkdi,Excelente- mulher inteligente vota em mulher inteligente,2024-09-11T03:12:12.854Z,0,0,0,2024-09-11T03:12:12.854Z,gandelman.bsky.social,,did:plc:fwd7q3qadqdotqlkmg2z7c3b
at://did:plc:spvnojyysev4cy65uqbjys45/app.bsky.feed.post/3l3vhevmsfb2t,bafyreid7dmyheop2dfunonve7rh5urmwqtuux66ecwhe67pfhmdvp6ycri,bsky.app/profile/anit...,2024-09-11T17:29:39.929Z,0,1,1,2024-09-11T17:29:39.929Z,anitablian.bsky.social,Rogério Anitablian,did:plc:spvnojyysev4cy65uqbjys45
at://did:plc:huw7u6jn66rlrrgpxeijjjmb/app.bsky.feed.post/3l3sogg63bv2p,bafyreidbgqp4bpbkuguh3go5sjnanzelceom2yspnxqkfwe7zgkyyszgjm,Atípica é a que tem filhos humanos ao invés de gatos?,2024-09-10T14:58:15.669Z,0,0,0,2024-09-10T14:57:48.025Z,dondracula.bsky.social,Don Drácula,did:plc:huw7u6jn66rlrrgpxeijjjmb
at://did:plc:7hnr3obzpjo4popomzqbja6i/app.bsky.feed.post/3l3so4x54hh2k,bafyreieyzjcq3mujbmlnvaj4xhuin2bjrkfymvbklsp677b3pourinonpy,"Adorei a iniciativa Tabata, não esperava menos de você 💖  eu te acho incrível por isso e por muito mais.",2024-09-10T14:52:29.265Z,0,0,0,2024-09-10T14:52:29.265Z,sabrino14681409.bsky.social,Roxinante Bilau,did:plc:7hnr3obzpjo4popomzqbja6i
at://did:plc:rzjzvb42lkrh3gzaf55mt4si/app.bsky.feed.post/3l3soej75oc2m,bafyreihxyahsvyyvxbpkkinkj6kuzcobj4zjbbhcgb3ibvhqxlae6rj7ue,"Tabata, vc é centro esquerda e está mais perto da centro direita que dá extrema esquerda. Eu sou centro direita mas votaria em vc se fosse de SP, mas se os eleitores do PT já te acham de direita, imagina do PSOL!! E não é possível que só 10% dos paulistanos não sejam extremistas!!",2024-09-10T14:56:43.578Z,0,0,0,2024-09-10T14:56:43.578Z,joaoacvieira.bsky.social,João Antonio ,did:plc:rzjzvb42lkrh3gzaf55mt4si
at://did:plc:p357ymrjubzwrzqjtu3mszcr/app.bsky.feed.post/3l3sf5nrmey2i,bafyreif47f6jzyrpdagbsfxhu7in4t7magelqus35yghjmeb2nd63qrq4m,"@tabatasp.bsky.social  incrível a sua campanha. A melhor campanha de todos! Está desvendando os ""códigos"". Vai subir mais ainda nas pesquisas.",2024-09-10T12:11:50.118Z,0,0,0,2024-09-10T12:11:50.118Z,ueberluiz.bsky.social,,did:plc:p357ymrjubzwrzqjtu3mszcr
at://did:plc:nrhwauowluznoeqwdhgalr2w/app.bsky.feed.post/3l3swxoakod2f,bafyreicjebbhsp44airbjhp36equotniephusptu3iufjnuxjytkadd3gq,@tabatasp.bsky.social atualiza seu app já pode postar vídeos aqui,2024-09-10T17:30:35.204Z,0,0,0,2024-09-10T17:30:35.204Z,sidneyoficial23.bsky.social,sidneynayano,did:plc:nrhwauowluznoeqwdhgalr2w
at://did:plc:huw7u6jn66rlrrgpxeijjjmb/app.bsky.feed.post/3l3rwulu2432v,bafyreifijlr5gzpwyk62jjyuq4zdazchzparsmzyzp4ckpcl46ue6o26ji,"Moça, esse estilo de documentário onde você olha para a diagonal ao invés da câmera para parecer mais autêntico na verdade é super fake. Você tem que falar mais naturalmente. Quem fez essa série para você tá com a cabeça no passado.",2024-09-10T07:56:41.253Z,0,0,0,2024-09-10T07:56:14.223Z,dondracula.bsky.social,Don Drácula,did:plc:huw7u6jn66rlrrgpxeijjjmb
at://did:plc:huw7u6jn66rlrrgpxeijjjmb/app.bsky.feed.post/3l3qvb35nrx25,bafyreieaa66nuebhppiqygutq3hcbqzvwiicnkfnpwxbtkrav2flfsg7yy,"Moça, não grava vídeo enquanto tá dirigindo. É muito perigoso.",2024-09-09T21:55:12.615Z,0,0,0,2024-09-09T21:54:45.426Z,dondracula.bsky.social,Don Drácula,did:plc:huw7u6jn66rlrrgpxeijjjmb
at://did:plc:djtg3v2tvu2qnc4u7jl2gggn/app.bsky.feed.post/3l3qqbltor32j,bafyreieov6n6r2yt52vrsqtn6aldaa6kdryiwr57bzgjoetfis4ndgyfme,Eu não esqueço que você acabou com a aposentadoria do povo.,2024-09-09T20:25:27.897Z,0,0,0,2024-09-09T20:25:27.897Z,antoniorosafi.bsky.social,Antônio,did:plc:djtg3v2tvu2qnc4u7jl2gggn
at://did:plc:rdp4e6uyn56sjm3krykz7chm/app.bsky.feed.post/3l3qpeexfja2f,bafyreiggdqihioojxm75t3dds2wjq4b4372zjvpnuy53mgyjwzh3ezg4me,Seguiremos vigilantes! E não esqueçam: bebam bastante água e evitem praticar atividade física ao ar livre.,2024-09-09T20:09:13.154Z,1,1,24,2024-09-09T20:09:13.154Z,tabatasp.bsky.social,Tabata Amaral 40,did:plc:rdp4e6uyn56sjm3krykz7chm
at://did:plc:rdp4e6uyn56sjm3krykz7chm/app.bsky.feed.post/3l3qpdwlctn2s,bafyreiblr3zuiuagsgibwnssdhpof3ylg2s4ajpfyaabm62wdniaap6xl4,"Em SP, temos um plano, que infelizmente foi colocado na gaveta. Como prefeita, vou atualizá-lo pra garantir medidas de mitigação, como a ampliação da frota de ônibus elétricos, e de adaptação, como mais áreas verdes, sobretudo na periferias.",2024-09-09T20:08:57.636Z,1,2,44,2024-09-09T20:08:57.636Z,tabatasp.bsky.social,Tabata Amaral 40,did:plc:rdp4e6uyn56sjm3krykz7chm
at://did:plc:k3d5qb5liv7soqvqgbvxt73y/app.bsky.feed.post/3l3qqs5ghn22o,bafyreiam7otdv23jxo46ittswrflnmhxbcwcccefk4yddrxu735zfdzls4,"É inacreditável como a gestão do Nunes deixou um plano tão importante de lado enquanto a qualidade do ar só piora. SP precisa de ações reais e urgentes, não de promessas vazias. Por isso você é a única candidata capaz de trazer algo que funcione...",2024-09-09T20:35:12.870Z,0,0,0,2024-09-09T20:34:49.529Z,heverton1.bsky.social,h. #Tabata4️⃣0️⃣,did:plc:k3d5qb5liv7soqvqgbvxt73y
at://did:plc:evnefddcbquw4znveinftgdq/app.bsky.feed.post/3l3qpnqawzf26,bafyreidncw4xsbcomxmd3pdyitrfehlociwv3dvz2fluq2txaobgsednbi,Amo SP mesmo poluída,2024-09-09T20:14:27.314Z,1,0,1,2024-09-09T20:14:27.314Z,johnyjapon.bsky.social,Naekaua,did:plc:evnefddcbquw4znveinftgdq
at://did:plc:4q7ppejjsf7gouumdnz2mf4r/app.bsky.feed.post/3l3qu467wgx2y,bafyreia42hifmfl6kkcirgosvy5d6t5wgr3giowd76o7c26jqotxi5bfny,"Tem é que prender esses donos de fazenda, chácaras,  agro que fazem queimadas diariamente sem se importar com saúde pública .",2024-09-09T21:34:06.774Z,0,0,0,2024-09-09T21:34:06.774Z,helenicec.bsky.social,Nice,did:plc:4q7ppejjsf7gouumdnz2mf4r
at://did:plc:4ke72rmu7a5ykuq25n5su2pk/app.bsky.feed.post/3l3r4yspah32v,bafyreibhkpvfk4jmvedmsybbmoadl3e3uxfjy5psg5gf7wyjvdxqi4mzfi,"Tá na hora de usar suas redes e seu grande alcance para cobrar todos.
Presidente 
Governador 
Prefeito
Afinal isto não é só um problema do município mas sim de todos.
Bora cobrar todos?",2024-09-10T00:13:17.594Z,0,0,0,2024-09-10T00:13:17.594Z,nebert.bsky.social,Nebert,did:plc:4ke72rmu7a5ykuq25n5su2pk
at://did:plc:z2kpjn33q4ugzeanrvxen7py/app.bsky.feed.post/3l3pyjetof52i,bafyreie2vmihsxanghsp3rhmtsfcwhm7qozrsxxnpcxzemiqmhw7bey2cq,E o professor? Terá chance de ir também?,2024-09-09T13:20:25.269Z,1,0,0,2024-09-09T13:20:25.269Z,profalessandro.bsky.social,Prof. Me.  Alessandro ,did:plc:z2kpjn33q4ugzeanrvxen7py
at://did:plc:xltfug7ikms4xr3glyuolsdp/app.bsky.feed.post/3l3pv5dv5dr2u,bafyreihvm3wwfzakrdv6klbri5xfcgxti46v3wvm3unpqveekhtpnde2oy,"Tabata, os estudantes querem o espanhol como língua obrigatória, a gente vive na América do Sul, pense nisso e valorize o espanhol",2024-09-09T12:20:00.211Z,2,1,5,2024-09-09T12:20:00.211Z,luizafritzen.bsky.social,Luiza Fritzen,did:plc:xltfug7ikms4xr3glyuolsdp
at://did:plc:xkmru5gt7bnv726fzylhhtcp/app.bsky.feed.post/3l3pvejowvi2e,bafyreifpvaza76ymg7v4yiwctn2majlee3dsvmd2u7ww4kowpcb5ejrroy,Em uma vaidade minimamente politizada essa Senhorita seria eleita no primeiro turno !!! Visão de futuro e globalização.,2024-09-09T12:24:01.311Z,1,0,0,2024-09-09T12:24:01.311Z,eng-anderson.bsky.social,Mutação Ideológica,did:plc:xkmru5gt7bnv726fzylhhtcp
at://did:plc:udpgs7qfcagi27usjo2nfyhv/app.bsky.feed.post/3l3pzc2xmc422,bafyreidd455mk3tmugx4w3ihegsp4u3h2xncx6gtk5p53li7ebh6ignj24,"Perfeito! Inglês é obrigatório para a população mais carente crescer economicamente, espanhol também é importante, mas como uma disciplina complementar não obrigatória",2024-09-09T13:34:13.648Z,0,0,0,2024-09-09T13:34:13.648Z,brunoalmeidamoreno.bsky.social,Bruno,did:plc:udpgs7qfcagi27usjo2nfyhv
at://did:plc:spbvrhps6lg6fmtjhblp7mev/app.bsky.feed.post/3l3qdcnckde2e,bafyreihk7pkdup6gsw6yxreg4ri5u7fy4a7kqdwwmdk3ru5eqj6eyh5aae,"que legal!
vão ter ingressos pra Disney, NBA ou NFL no pacote? 😁",2024-09-09T16:33:30.327Z,0,0,0,2024-09-09T16:33:30.327Z,ficaadica.bsky.social,serenus,did:plc:spbvrhps6lg6fmtjhblp7mev
at://did:plc:rzjzvb42lkrh3gzaf55mt4si/app.bsky.feed.post/3l3q4rsaz4w2v,bafyreia7cr4ulkwlvjzvs5t2vcanftqe7qdqwyeep5fbdfmxgomxgkreey,"Tabata, pense na metodologia de ensino de inglês tbm, nem adulto aguenta aqueles cursos de inglês antiquados de 6 anos, com gramática inglesa etc, imagina a criançada!! Os cursos mais modernos como Wise Up ensinam de maneira dinâmica o inglês prático do dia a dia, é isso!!",2024-09-09T14:36:42.555Z,0,0,0,2024-09-09T14:36:42.555Z,joaoacvieira.bsky.social,João Antonio ,did:plc:rzjzvb42lkrh3gzaf55mt4si
at://did:plc:kkw4hll5p3zzzyhua7qvwqvw/app.bsky.feed.post/3l3pvdyegnn2c,bafyreia6fnifk7xsgojf4jmgijvgmhwb5f23befs3cc7odsjeoidwqfjci,"Tem algumas ideias da prefeitura de Recife aí, hein? Kkkkkk 🫶🏼",2024-09-09T12:23:42.996Z,0,0,0,2024-09-09T12:23:42.996Z,amandadounis.bsky.social,Amanda Dounis,did:plc:kkw4hll5p3zzzyhua7qvwqvw
at://did:plc:jttlexkmbohevcoozwvvknit/app.bsky.feed.post/3l3pyehcpss2r,bafyreifx6mi6sttntxrwhxwkt7ywu7fqcp762vmhyj3rk4ki2kvf5rg5ma,Precisamos de espanhol nas escolas públicas como disciplina obrigatória!!!,2024-09-09T13:17:40.066Z,1,0,0,2024-09-09T13:17:40.066Z,iagomarianx.bsky.social,iago,did:plc:jttlexkmbohevcoozwvvknit
at://did:plc:dpag3ikbgq45g5q5fw5vayff/app.bsky.feed.post/3l3pveckoyi25,bafyreihcdxtd2j5ujl6plvvn7qdmkm6dz63ln6jx3evq45ojiiltdottv4,"Infelizmente a população está escolhendo entre três asnos. 
No fim, voltaremos ao problema de escolher o ""menos pior"".",2024-09-09T12:23:52.743Z,0,0,1,2024-09-09T12:23:52.743Z,miranda-ivan.bsky.social,Karl,did:plc:dpag3ikbgq45g5q5fw5vayff
at://did:plc:6ixjrufbcn2wizn457qknbp2/app.bsky.feed.post/3l3q24oytmh2k,bafyreian2vczx6k4ndlsm3gdvkbw44dj2rkabzfiwja5qusvjdw75vnnjq,"precisamos do Espanhol, Chinês e Russo",2024-09-09T13:49:06.824Z,1,1,1,2024-09-09T13:49:06.824Z,igorht08.bsky.social,IGOR HERMANO TRINDADE ,did:plc:6ixjrufbcn2wizn457qknbp2
at://did:plc:23v3exeabthypqaavlrzpj6f/app.bsky.feed.post/3l3qbdgsmab2j,bafyreidtnmfufndyavhknzwi3nqrcrctb4u2lq4hsrwtj74cuy263rcnie,E o Espanhol?? só os vira-latas desses País não querem que o nosso Povo aprenda a língua dos nossos vizinhos...,2024-09-09T15:58:07.976Z,0,0,0,2024-09-09T15:58:07.976Z,harrisonravelle.bsky.social,Harrison Ravele,did:plc:23v3exeabthypqaavlrzpj6f
at://did:plc:rdp4e6uyn56sjm3krykz7chm/app.bsky.feed.post/3l3ooojqzwu2u,bafyreigei2i5kxgkngu7piexzggaaqjjp3r2aj5tmc23lhy2drcijp3q6m,"Iremos ampliar as parcerias da Prefeitura com o Centro de Treinamento Paralímpico e criar o programa Meu Primeiro Emprego, com uma linha dedicada ao esporte paralímpico, pra citar alguns exemplos. 

Parabéns a todos os nossos paratletas! Viva a nossa seleção! 🇧🇷🏅",2024-09-09T00:51:41.969Z,0,2,55,2024-09-09T00:51:41.236Z,tabatasp.bsky.social,Tabata Amaral 40,did:plc:rdp4e6uyn56sjm3krykz7chm
at://did:plc:bkoh4ngy4mpjtd7q3ik5cz7p/app.bsky.feed.post/3l3oscch3bs2m,bafyreidcwenykpxkbzapu6cksawjflggrzspnuv4dpo3qrdfrw5khzr5p4,"Seus projetos são inovadores e viáveis. Torcendo muito pela sua eleição. São Paulo não pode perder essa oportunidade! 

#Tabata40",2024-09-09T01:56:25.335Z,0,0,0,2024-09-09T01:56:25.335Z,elianediniz.bsky.social,ElianeDiniz ,did:plc:bkoh4ngy4mpjtd7q3ik5cz7p
at://did:plc:7qvc7xye5tvxs7dtmgfvpqdh/app.bsky.feed.post/3l3oqhx6kna2i,bafyreiau5loiab2tulbmtps2u4i673rkgkozny7toasa5g6knyqauur6pa,2050 medalhas diferentes,2024-09-09T01:23:46.468Z,0,0,0,2024-09-09T01:23:46.468Z,misc07.bsky.social,,did:plc:7qvc7xye5tvxs7dtmgfvpqdh
at://did:plc:lcsp47zqwvhvlxk5l6sdrfii/app.bsky.feed.post/3l3ooduba5m2o,bafyreifzctjxth4r24qxmv2y6jmh5hgkxvpdkpvxvsh7soirvoq2p7li34,"Esse projeto seu é fodão, mas infelizmente estamos no Brasil e as pessoas nem querem saber de nada.. Então bote o dedo na cara de vagabundo criminoso, como vem fazendo, que estamos fechados com você",2024-09-09T00:45:42.803Z,1,0,1,2024-09-09T00:45:42.803Z,thlouzada.bsky.social,Thiago,did:plc:lcsp47zqwvhvlxk5l6sdrfii
at://did:plc:v6urpcdxhnycn6o7pmloqwln/app.bsky.feed.post/3l3qtp7oxrr2y,bafyreicdkdxqgffjyhe62yfnaa2recv5ijfqxbw7ap4e46xatf5bo4kfma,😅😅,2024-09-09T21:28:07.815Z,0,0,0,2024-09-09T21:26:52.433Z,valeriayida.bsky.social,,did:plc:v6urpcdxhnycn6o7pmloqwln
at://did:plc:maiaixy7ium2paymck6ar3y4/app.bsky.feed.post/3l3prfcqcoq2p,bafyreifkh2z7sn3mjz5fnrzc3kla4bdm6hg43nst7imktujgr2gecb46d4,"Sai o ""Bom dia, Verônica"", entra o ""Bom dia, Tabata"".",2024-09-09T11:12:52.553Z,0,0,1,2024-09-09T11:12:52.553Z,welintonozelin.bsky.social,Welinton Ozelin,did:plc:maiaixy7ium2paymck6ar3y4
at://did:plc:b56hfl4udpb5bk47m2s7wdb7/app.bsky.feed.post/3l3w5nojzvg2x,bafyreic6xxllyn35zhdmrk5h4y65j7g7eelltw2whxju5xvhn76xeohf24,Meu voto é seu Jessica Jones,2024-09-12T00:08:14.617Z,0,0,0,2024-09-12T00:08:14.617Z,leandromad.bsky.social,Leandro Butcher,did:plc:b56hfl4udpb5bk47m2s7wdb7
at://did:plc:7hnr3obzpjo4popomzqbja6i/app.bsky.feed.post/3l3oa33r75m2s,bafyreiewxuvaykb2dom75pcxywatnyubkrxpgr6fmsugy4c6tpuywpf4sm,"EU AMO SUA SKIN 🤩🤩🤩 mano imagina vc chegando no debate um dia assim, Tabata modo combate ao crime, Pablo já ia ficar pálido na hora.",2024-09-08T20:30:15.753Z,0,0,2,2024-09-08T20:30:15.753Z,sabrino14681409.bsky.social,Roxinante Bilau,did:plc:7hnr3obzpjo4popomzqbja6i
at://did:plc:57pxr4vyawfzejmfb43vle2j/app.bsky.feed.post/3l3oebo2w4z2l,bafyreifnezl5wlzjqyemw7tuqkt2jy4pbgy7jvhkxtq3gryvo3w4xqbone,"Vc vai doar?
charidy.com/fundodebolsas",2024-09-08T21:45:32.394Z,0,0,0,2024-09-08T21:45:32.130Z,lexjcq.bsky.social,ÆLex-אלכס,did:plc:57pxr4vyawfzejmfb43vle2j
at://did:plc:kwe5lwqhqswa7umh5wp4tisi/app.bsky.feed.post/3l3ninzja752z,bafyreiflchpapchgbscgwnxfhc4ntnrv5b3bxnagedequru2vmympqlg54,"Tábata, mas o público infelizmente não se importa com isso. Você tem que convencer o TSE sobre os crimes cometidos. São eles que estão sendo negligentes.",2024-09-08T13:31:21.823Z,0,0,0,2024-09-08T13:31:21.823Z,borntorebellion.bsky.social,Só mais um Plínio Ⓐ 🏴🚩,did:plc:kwe5lwqhqswa7umh5wp4tisi
at://did:plc:k3d5qb5liv7soqvqgbvxt73y/app.bsky.feed.post/3l3nkgsqcob2g,bafyreictiax2kedt65w4fgqlufj77z3ic4ryz2gdbk3tgwidwpr4mu6vtu,Vídeo incrível! 👏🏻👏🏻👏🏻,2024-09-08T14:02:59.118Z,0,0,0,2024-09-08T14:02:59.118Z,heverton1.bsky.social,h. #Tabata4️⃣0️⃣,did:plc:k3d5qb5liv7soqvqgbvxt73y
at://did:plc:gicw4vxf3f4xeop5zvpnymje/app.bsky.feed.post/3l3o6yyxqi227,bafyreif25horjr4m7akzdhqzjwoy6csci3zwq3fo6s3afipx2hhqlcop4i,Boa tarde! Sobre as eleições em SP. Leia em votopositivo-cg.blogspot.com/2024/09/bole...,2024-09-08T20:11:11.845Z,0,0,0,2024-09-08T20:11:11.845Z,vagnervotopositivo.bsky.social,,did:plc:gicw4vxf3f4xeop5zvpnymje
at://did:plc:dvlzmqwnde5oiwsnqgpwwwer/app.bsky.feed.post/3l3nkpehdbi2b,bafyreie7ii5uaacdunvmcwsv4wfagbzbeeby6tlqzxwlph3tsk4dwjhdxm,"adorei que vc incorporou o ""ChaTabata"".

Pra cima do coach!",2024-09-08T14:07:52.737Z,0,0,1,2024-09-08T14:07:52.737Z,elgualberton.bsky.social,El Gualberton 🚩🇺🇳🇨🇺,did:plc:dvlzmqwnde5oiwsnqgpwwwer
at://did:plc:7uwmmedgaoahvn5jixhj52vc/app.bsky.feed.post/3l3nk5pgbp62f,bafyreieeizpcpnl6dy3j4jxydot3fr52fik6sqz5rzudgkmq2stz2hwd3a,"Menina, você está andando com segurança?

Que porrada na cara desse coach. Os vídeos da sua campanha estão incríveis e são muito necessários.",2024-09-08T13:58:01.282Z,0,0,3,2024-09-08T13:58:01.282Z,sanderlust.bsky.social,San 🧭,did:plc:7uwmmedgaoahvn5jixhj52vc
at://did:plc:7qvc7xye5tvxs7dtmgfvpqdh/app.bsky.feed.post/3l3nmvwplcs2e,bafyreie7gcd4vejzghrkj5woziiaxuadfrx7bsoy5ns6jx6gvnmw64aqqi,"Se a carreira política desandar, pode ingressar numa banda de rock.",2024-09-08T14:47:20.728Z,0,0,0,2024-09-08T14:47:20.728Z,misc07.bsky.social,,did:plc:7qvc7xye5tvxs7dtmgfvpqdh
at://did:plc:7hnr3obzpjo4popomzqbja6i/app.bsky.feed.post/3l3ng7ksrqz2c,bafyreif2sveiefzlu2lui5yz33qm3mvzuiece3n5pcl4oapaxo5qk3fzia,"Boraa Tabata, é de suma importância que vc siga em campanha nas ruas, tome como exemplo a campanha passada do boulos q foi pras ruas e teve uma arrancada pra ir pro segundo turno. Vc consegue fazer isso tbm, confio em vc.",2024-09-08T12:47:28.427Z,0,0,2,2024-09-08T12:47:28.427Z,sabrino14681409.bsky.social,Roxinante Bilau,did:plc:7hnr3obzpjo4popomzqbja6i
at://did:plc:7h2kgohig55vmyhwtpmxzuqn/app.bsky.feed.post/3l3nhc3iubh2d,bafyreifpuf7awdt5m2gvgqsegqpaxa2nsheaxj6fzh4tx2tvmnbgydzr2a,Eu também fui o primeiro a chamar o Pablo de jogo do tigrinho. Também fui o primeiro a vinculá-lo ao Pablo Escobar,2024-09-08T13:06:47.156Z,2,0,1,2024-09-08T13:06:47.156Z,jaildon.bsky.social,Jaildon Lima,did:plc:7h2kgohig55vmyhwtpmxzuqn
at://did:plc:57pxr4vyawfzejmfb43vle2j/app.bsky.feed.post/3l3oena4cym2j,bafyreiainmodbfk53eebe5icgrafbr5ktbi6b7fgy24dvfpdn7tyrvq5si,"Vc vai doar?
É muito importante!
charidy.com/fundodebolsas",2024-09-08T21:52:00.561Z,0,0,0,2024-09-08T21:52:00.221Z,lexjcq.bsky.social,ÆLex-אלכס,did:plc:57pxr4vyawfzejmfb43vle2j
at://did:plc:23v3exeabthypqaavlrzpj6f/app.bsky.feed.post/3l3ntb2dc5c2q,bafyreicrtcsugzcrmqvfwpfiphzpuezhnysdddgedxqhaibyb2ngbngzy4,"Acho que a Esquerda deveria fazer um pacto já no 1° turno, ex: se nos últimos 15dias pra eleição a maioria das Pesquisas mostrarem que Boulos não ganha do Nunes no 2° e a Tabata ganha, Boulos pediria voto útil na Tabata e assim o contrário, afinal, o que importa é que alguém da Esquerda ganhe.",2024-09-08T16:40:55.010Z,0,0,0,2024-09-08T16:40:55.010Z,harrisonravelle.bsky.social,Harrison Ravele,did:plc:23v3exeabthypqaavlrzpj6f
at://did:plc:23v3exeabthypqaavlrzpj6f/app.bsky.feed.post/3l3nsxqlj452m,bafyreiduafncluooovvtxroxt5jazacljtpuyx5itsq2kxccwcqd75tq7a,"Muito bom. infelizmente, acho que a Direita e grande parte do Centro estão fechados com o coach criminoso, msm sabendo de todos os rolos, crimes e tal por puro ódio a Esquerda, muitos nem sabem pq essa raiva e a maioria é acredita em mentiras ridículas.",2024-09-08T16:35:42.800Z,0,0,0,2024-09-08T16:35:42.800Z,harrisonravelle.bsky.social,Harrison Ravele,did:plc:23v3exeabthypqaavlrzpj6f
at://did:plc:rdp4e6uyn56sjm3krykz7chm/app.bsky.feed.post/3l3lp5cpyac2h,bafyreighvslwt2idwo4mr2fo27jrvlqldxyd7dcjs2my6m7xwthuckqkye,O subtenente da PM trabalhava há mais de 30 anos na corporação e essa era sua última participação no desfile. Minhas orações estão com seus familiares e amigos!,2024-09-07T20:21:57.357Z,0,1,45,2024-09-07T20:21:57.357Z,tabatasp.bsky.social,Tabata Amaral 40,did:plc:rdp4e6uyn56sjm3krykz7chm
at://did:plc:evnefddcbquw4znveinftgdq/app.bsky.feed.post/3l3lqm45iul2l,bafyreiaoodghtcs42dg2aygbxwnozfa3sofxjm535647ph7u46hnqmiioe,"Aff não acredito.
Coitado.

Meus pesâmes",2024-09-07T20:48:07.724Z,0,0,0,2024-09-07T20:48:07.724Z,johnyjapon.bsky.social,Naekaua,did:plc:evnefddcbquw4znveinftgdq
at://did:plc:jqq45izhsaz26cqr43hj2uza/app.bsky.feed.post/3l3jjmggrzh2t,bafyreihx3ksz6oelu3mceqapowo4frpgnoh7mvuivowd54nhgyosy6rb3a,"Postura sensata não é algo que podemos esperar de governos populistas.

A melhor estratégia para zelar por sua reputação é manter distância deles.",2024-09-06T23:37:42.573Z,1,0,2,2024-09-06T23:37:42.573Z,innenw.bsky.social,,did:plc:jqq45izhsaz26cqr43hj2uza
at://did:plc:fofwzezjdjfha7eonrcfvlgs/app.bsky.feed.post/3l3m5je4edk2o,bafyreieuw6apaj5vsult736gjeqkvkr57n7oz7g7ajtufmlesxjc5eau4q,Só 7 meses,2024-09-08T00:39:14.062Z,0,0,1,2024-09-08T00:39:14.062Z,marcosvidigal.bsky.social,,did:plc:fofwzezjdjfha7eonrcfvlgs
at://did:plc:bbirqdgctmleubagoontwfhb/app.bsky.feed.post/3l3jnnams2i2v,bafyreic4nvnz554f2cfgibext2ou4igecqikobrli7rmv6sjfp2nury4za,"É de impressionar que um comentarista como Joel Pinheiro coloque em planos absolutamente iguais uma disputa juridica de assedio sexual. Só com cameras em todos os lugares, inclusive debaixo das mesas de reuniao,  ao é Joel.Ora, ora,",2024-09-07T00:49:44.424Z,0,0,0,2024-09-07T00:49:44.424Z,democraciasim.bsky.social,,did:plc:bbirqdgctmleubagoontwfhb
at://did:plc:7nxis6h4wfupck6zawzikelj/app.bsky.feed.post/3l3jptno44j2y,bafyreihqtihbhaav35zrwgbhgc346rzczjzleqhuvcgvrmoesmc56kuhee,Concordo totalmente,2024-09-07T01:29:07.638Z,0,0,0,2024-09-07T01:29:07.638Z,florencioq.bsky.social,Florêncio Queiroz,did:plc:7nxis6h4wfupck6zawzikelj
at://did:plc:33zzrgfodog3wtbpilutwiif/app.bsky.feed.post/3l3nvtjtlav2m,bafyreicy6lnoln76r4dywbgafatvzvruvz5iktmklaxvclvfwnwwfyb73u,"O Lula, na sua cabeça, não vê nada demais, foi preciso a janja engrossar. Afinal, ele é o cara do ""grelo duro"", da ""mulher de corintiano"".",2024-09-08T17:27:04.903Z,0,0,0,2024-09-08T17:27:04.903Z,wagnerzawasky.bsky.social,,did:plc:33zzrgfodog3wtbpilutwiif
