uri,cid,text,created_at,reply_count,repost_count,like_count,indexed_at,author_handle,author_display_name,author_did
at://did:plc:ewnzldfl5faee4fkbqeeukl2/app.bsky.feed.post/3l4aks4fsrd2y,bafyreib43au7vgucp5ydiqdqhjpjybs3avpwkq7uxcxn47v3chjxmyr7fi,Se jogar outra cadeira nele tem meu voto,2024-09-16T03:30:01.430Z,1,0,39,2024-09-16T03:30:01.430Z,diogoaprato.bsky.social,,did:plc:ewnzldfl5faee4fkbqeeukl2
at://did:plc:evnefddcbquw4znveinftgdq/app.bsky.feed.post/3l4akye7o6i2y,bafyreiavp27g6vfha6in342wu4cghfg3r3ad35uz5tnjgsyxz5m5xjy3su,"Escrota.

Da violência contra a mulher você não quis falar, sua hipócrita.

Só usa o erro do Datena contra ele.

Nojenta. Só pensa em celular.",2024-09-16T03:33:30.902Z,1,0,2,2024-09-16T03:33:30.902Z,johnyjapon.bsky.social,Naekaua,did:plc:evnefddcbquw4znveinftgdq
at://did:plc:dnva3ke6osjbj3yjgfzh5y7b/app.bsky.feed.post/3l4b5nhzhwj26,bafyreiebwnx7leg6daazqv2op2rdhoosotqwrkocql3dfog36gy3rundda,Acho que nunca. Quem faz as leis são ineptos com interesses escusos. Não dá pra esperar muito mais do que isso.,2024-09-16T09:07:26.779Z,0,0,0,2024-09-16T09:07:26.779Z,alemello.bsky.social,AlêMello,did:plc:dnva3ke6osjbj3yjgfzh5y7b
at://did:plc:dnfzqd42nlgv4ozdmnik3bie/app.bsky.feed.post/3l4b6rbiby726,bafyreihnhopepige34idoiovumxt4vkmw3qh3bbok5kxgjkno3xun3xohm,"Tabata, te amamos, mas a atração por toda essa baixaria é forte demais pra mim.",2024-09-16T09:27:28.117Z,0,0,0,2024-09-16T09:27:28.117Z,helofernandes.bsky.social,,did:plc:dnfzqd42nlgv4ozdmnik3bie
at://did:plc:col5kyvhv76bm5lkqkhdh7wv/app.bsky.feed.post/3l4alhm2ua72k,bafyreife5d4g2dvq323is366uhamuhem4nrbtpmvp7t2qcficyrcnt57p4,"Na boa, o sujeito implorou para que isso acontecesse.
E você, apoia logo o #Boulos e seja Secretária de Educação da administração dele.",2024-09-16T03:42:01.934Z,0,0,3,2024-09-16T03:42:01.934Z,cipinzani.bsky.social,,did:plc:col5kyvhv76bm5lkqkhdh7wv
at://did:plc:buznjo4s6pc5jcdjsf532ouz/app.bsky.feed.post/3l4aky2ialu2m,bafyreiflqimda4bh2ettmhcr54taell4jt7lnukypfc3ogvyvhsh5thfi4,"pelo amor de deus
 da uma cadeirada nele também, mulher",2024-09-16T03:33:20.825Z,0,0,18,2024-09-16T03:33:20.825Z,bastosraph.bsky.social,Raphael Lorofous,did:plc:buznjo4s6pc5jcdjsf532ouz
at://did:plc:7tnrh3ppigqn4asdgxhlx3a6/app.bsky.feed.post/3l4behismdh2u,bafyreiatime3enmptoen2nfpdrh4e77fnjhwwhbyiajajf6t3pgockwvvu,"Esse tipo de ironia explica porque um fato que seria um escândalo num país sério, aqui é só fonte para memes…🤦‍♂️🙄",2024-09-16T11:09:22.772Z,0,0,0,2024-09-16T11:09:22.772Z,wallaby.bsky.social,Wallaby ,did:plc:7tnrh3ppigqn4asdgxhlx3a6
at://did:plc:7fdm42zgqhaqhhatiwjt6tl4/app.bsky.feed.post/3l4b6m5p7g62d,bafyreiewm4oavda4cjur3bls6yq2niwfy7oa76ned4tpub62zqvn6zga2y,Ela se perdeu na personagem totalkkkkkk,2024-09-16T09:24:36.505Z,0,0,0,2024-09-16T09:24:36.505Z,darcijr.bsky.social,Darci Gonçalves ,did:plc:7fdm42zgqhaqhhatiwjt6tl4
at://did:plc:5jid3akoa6hqfyeloy54diai/app.bsky.feed.post/3l4altsvda224,bafyreig44r46h6kdjgexpf7hdfcjsfxvacwb3j46srckolyumgvardew7e,A pergunta do Amassado foi respondida.,2024-09-16T03:48:52.437Z,0,0,1,2024-09-16T03:48:52.437Z,vgon.bsky.social,Velho Brasil Pobre,did:plc:5jid3akoa6hqfyeloy54diai
at://did:plc:4ke72rmu7a5ykuq25n5su2pk/app.bsky.feed.post/3l4b6ohfrlx2o,bafyreigpzonqau6miutrvsmdqxqfjpwrogcz4ylgyt6cqaprdff45t3lbe,"O nível do debate começa antes com ataques a candidatos em redes sociais, televisão e rádio. 
O clima dele é determinado pelos candidatos que optam por ataques aos adversário em vez de levar suas propostas.
Mas este é um assunto para quem espera uma política séria no Brasil.",2024-09-16T09:25:53.732Z,0,0,0,2024-09-16T09:25:53.732Z,nebert.bsky.social,Nebert,did:plc:4ke72rmu7a5ykuq25n5su2pk
at://did:plc:4cnabsjgdctc6yrws6khepja/app.bsky.feed.post/3l4aksqkzbi2n,bafyreibmdgty6l2zkhcyjxniofkqm26fe3gc7zi7puzgzeqlgqsylofiaa,Qualquer debate que tiver um PROVOCADOR terá esse tipo de risco.,2024-09-16T03:30:21.955Z,0,0,12,2024-09-16T03:30:21.955Z,frankminesotta.bsky.social,Dr. Frank James Minnesota,did:plc:4cnabsjgdctc6yrws6khepja
at://did:plc:44jtyr5xeiw6qpbilnxp5uxy/app.bsky.feed.post/3l4ann2wtx62w,bafyreid2oxzmwkoyvb5vhffg3jht5ys7ub52ahwmqll5vi5zpgfxlvmcyi,Vc falou do BO da esposa. Não pensa q não assistimos os outros encontros.,2024-09-16T04:20:53.979Z,1,0,1,2024-09-16T04:20:53.812Z,umamutti.bsky.social,Sandra 🦣 ,did:plc:44jtyr5xeiw6qpbilnxp5uxy
at://did:plc:3kcekugombg6hwgsyenqricu/app.bsky.feed.post/3l4awrqotsd2z,bafyreicfcnk4gogcsxo5nbe5w27dsyrtwlesc62xhmgwuwpqvr6zvdzlny,100% de acerto nessa cadeirada já ia ser um bom começo!,2024-09-16T07:04:32.489Z,0,0,0,2024-09-16T07:04:32.489Z,lucianouououyeah.bsky.social,Luciano 🇪🇭 🖖,did:plc:3kcekugombg6hwgsyenqricu
at://did:plc:2ttimiasyrukpflgdzuc5t2h/app.bsky.feed.post/3l4c55ntpng2n,bafyreibtxqilraqmyaft233vcnkzikbtslwfjgbytaa4u5h4pkijdpgape,"Tabata se isenta e perde credibilidade 
Lamaçal destila mentiras,  destilas fakenews, é associado ao pcc 
Comete crime contra a honra do Datena ofende e provoca 
Datena se exaltou mas não errou  não 
O coach mentiroso mereceu",2024-09-16T18:31:15.377Z,0,0,0,2024-09-16T18:31:15.377Z,affsoares.bsky.social,,did:plc:2ttimiasyrukpflgdzuc5t2h
at://did:plc:2s2su3ekpciwpkve3qvx4jnw/app.bsky.feed.post/3l4anlrccwd2f,bafyreibenbqc7rag3kxsuyrxbnsms2myar7arsmuwtdidotkiv34c26ape,bsky.app/profile/astr...,2024-09-16T04:20:07.828Z,0,0,3,2024-09-16T04:20:07.828Z,astrocassio.bsky.social,ᥴꪖᦓᦓ꠸ꪮ,did:plc:2s2su3ekpciwpkve3qvx4jnw
at://did:plc:2bhogepz6v4zy2ravibopuxg/app.bsky.feed.post/3l4b7j35vpn27,bafyreihn6lwudoqabhuiebbloko5x7jshkj6nz7aevqsqj362udepkx32i,Quando pararem de aceitar coachs trambiqueiros como candidatos.,2024-09-16T09:40:27.610Z,0,0,0,2024-09-16T09:40:27.610Z,jvcarts.bsky.social,JVCarts 🔞,did:plc:2bhogepz6v4zy2ravibopuxg
at://did:plc:wwj36moxsixq4dovyj7ihgng/app.bsky.feed.post/3l4bnwl3sph2u,bafyreidztbw6tihepznj5dzho4rsf57g4w4ymrbgeu6tjxvddyx6rn257i,"Que no dia 6 SP se pinte de laranja, é 4⃣0⃣❗💖",2024-09-16T13:58:38.612Z,0,0,0,2024-09-16T13:58:38.612Z,bayzusbee.bsky.social,Bayzusbee,did:plc:wwj36moxsixq4dovyj7ihgng
at://did:plc:tjmkty6yrfc4qrephwakooip/app.bsky.feed.post/3l4b6be5djm2q,bafyreicejt5bvrmenatzmokjbhd2mpad76fc5756y6xfclgn6ticogivou,"Datena teria feito melhor se tivesse  usado do seu tempo e perguntado ao TRE DE SP:  POR QUÊ MARCOLA NÃO TEM CANDIDATURA IMPUGNADA? 
ELE DESRESPEITA TODAS AS REGRAS, DESTRÓI E DESMORALIZA O PROCESSO ELEITORAL ABUSO DE PODER ECONÔMICO E USO INDEVIDO DA IMAGEM. SE UTILIZA DE MÁ FÉ O TEMPO INTEIRO.",2024-09-16T09:18:34.076Z,0,0,1,2024-09-16T09:18:34.076Z,angelinablue.bsky.social,Angelina🚩,did:plc:tjmkty6yrfc4qrephwakooip
at://did:plc:ndbynvrmyas7a6zzg22ccs3r/app.bsky.feed.post/3l4ahwemka62x,bafyreidc5ui35e52662yquwg3hwqrbof2tx27uknzoacooge3ccrmeceiy,"Regras do debate: proibido dar cadeirada no amiguinho, mas se quiser, pode.",2024-09-16T02:38:42.863Z,0,0,0,2024-09-16T02:38:42.863Z,guilhermerox.bsky.social,,did:plc:ndbynvrmyas7a6zzg22ccs3r
at://did:plc:evnefddcbquw4znveinftgdq/app.bsky.feed.post/3l4aipq7t2r22,bafyreiaiqur5xwgwghm5fj53btjfrnncecnjstb54dewgd5inmdp3x3v4u,"Tabata reclama de baixaria, mas FUGIU sobre o assunto de violência contra mulher.

Sua hipócrita.",2024-09-16T02:52:54.047Z,0,0,0,2024-09-16T02:52:54.047Z,johnyjapon.bsky.social,Naekaua,did:plc:evnefddcbquw4znveinftgdq
at://did:plc:evnefddcbquw4znveinftgdq/app.bsky.feed.post/3l4ag53ffmn23,bafyreie6imcloyj57c455g3eaoeeet7k3hqbarx67q7rf75fpl5dlzswru,"Deixa seu pai descansar em paz, Tabata.

Todo debate vc trazendo o falecido.

Para com isso",2024-09-16T02:06:40.830Z,0,0,0,2024-09-16T02:06:40.830Z,johnyjapon.bsky.social,Naekaua,did:plc:evnefddcbquw4znveinftgdq
at://did:plc:evnefddcbquw4znveinftgdq/app.bsky.feed.post/3l4afwekqkp2i,bafyreigwetuyi7fbt5vs7q43lj2r5j2zkqlncpb77uhoshg3xihqtz7ucm,"Todo debate, Tabata vem com o falecido pai, forçando assunto.

Eu tentei gostar viu.

Mas nem parece que é inteligente",2024-09-16T02:02:55.277Z,0,0,1,2024-09-16T02:02:55.277Z,johnyjapon.bsky.social,Naekaua,did:plc:evnefddcbquw4znveinftgdq
at://did:plc:evnefddcbquw4znveinftgdq/app.bsky.feed.post/3l4af3opvtu2q,bafyreihzdjrusyoz7zuwdiifmiqe2hhchfze3qkqwkzr5uw4ynzx6tvzvq,"Tabata fugir da questão da violência contra mulher pra falar de roubo de celular? Que despreparada , patética.

O celular é muito importante pra geração da Tábata né.

Tiktoker",2024-09-16T01:47:59.901Z,0,0,0,2024-09-16T01:47:59.901Z,johnyjapon.bsky.social,Naekaua,did:plc:evnefddcbquw4znveinftgdq
at://did:plc:2s2su3ekpciwpkve3qvx4jnw/app.bsky.feed.post/3l4ail33mux2m,bafyreifvhxv4v4asthwmzjof5qwqwjmxmqrmkpunzwmrgikcbw2qnum6lu,bsky.app/profile/astr...,2024-09-16T02:50:15.837Z,1,0,1,2024-09-16T02:50:15.837Z,astrocassio.bsky.social,ᥴꪖᦓᦓ꠸ꪮ,did:plc:2s2su3ekpciwpkve3qvx4jnw
at://did:plc:w3fwnyji4jkk4rhk52unxdwv/app.bsky.feed.post/3l4acagijct27,bafyreid3e4gqmbiifmjqrk2srzwjirdfgskaxq7pnomhw7x42fyt4v737m,,2024-09-16T00:56:57.135Z,0,0,1,2024-09-16T00:56:57.135Z,wal2025.bsky.social,Waldemar Vilhena ,did:plc:w3fwnyji4jkk4rhk52unxdwv
at://did:plc:nsgk26oaho6azxybvonr35qe/app.bsky.feed.post/3l4bdpp72tk2v,bafyreicllahi2n5sb5flptw75ic7lmfhnsavcamxuvvzkjyszlu32omwhi,Futura presidenta ❤️,2024-09-16T10:56:03.193Z,0,0,0,2024-09-16T10:56:03.193Z,esdruxulo.bsky.social,Esdrúxulo (45/65),did:plc:nsgk26oaho6azxybvonr35qe
at://did:plc:k4e5m65gyywqcxn5po64bicq/app.bsky.feed.post/3l47werjhtk2p,bafyreicmghbrmbpmlyllnk2gzcgqn4a7m3tchipcev4kfcswipxyxwuv7a,"Eu (ainda) não voto em você, mas não sou cego: Pé-de-meia é um senhor projeto e dá orgulho vê-lo sendo executado.",2024-09-15T21:24:40.568Z,0,0,1,2024-09-15T21:24:39.411Z,favovs.bsky.social,Fa Vovs,did:plc:k4e5m65gyywqcxn5po64bicq
at://did:plc:irlxg6wvdae4xjluxyae5ijy/app.bsky.feed.post/3l47zk5el5q2t,bafyreifhvgsv664vu7hzxzd5oeaqdbohtkjipyuy3pcxdn6o6rfcnfv4xm,"Essa é a razão pela qual vc não consegue vencer Marçal  nas pesquisas. Você é muito ""boa moça"", toda ""perfeitinha"". Tão galera. Tão normal. Tão legal. Tão jovem. Tão nobre. Tão dotada. Tão centrada... que chega a ser chata, apesar das boas intenções. Vc precisa ser mais rock n' roll. Taca o foda-se.",2024-09-15T22:21:20.443Z,0,0,0,2024-09-15T22:21:20.443Z,nayanex.bsky.social,Nayanexx.pie,did:plc:irlxg6wvdae4xjluxyae5ijy
at://did:plc:evnefddcbquw4znveinftgdq/app.bsky.feed.post/3l4af4wwzob2l,bafyreiff2nzj7buoffu3z3e4cgb5s77jxekdsefawncq4txw5vinvcusuy,"Tabata, celular é mais importante que violência contra mulher né.

Tonhona",2024-09-16T01:48:42.422Z,0,0,0,2024-09-16T01:48:42.422Z,johnyjapon.bsky.social,Naekaua,did:plc:evnefddcbquw4znveinftgdq
at://did:plc:xhg5g5dlb6i3kzdyn77dvl2x/app.bsky.feed.post/3l45mfmtnmv2q,bafyreiege72zvsxdgrw3pve2bgugqa4nmnt5joyvdh3qo5moh6ln6g26da,Para o bem de São Paulo vc deveria se juntar a Bolos para deter a maldita extrema direita. Seria ótimo ter vc com ele na prefeitura.,2024-09-14T23:20:50.869Z,1,0,1,2024-09-14T23:20:50.869Z,sissipas.bsky.social,Sissi,did:plc:xhg5g5dlb6i3kzdyn77dvl2x
at://did:plc:wbztshjyajpj374mkrpjak77/app.bsky.feed.post/3l47kzir4fr2d,bafyreig27o2nvh4kqzl7ny4ml3h37mwze5oiapg6lnzyrvh2vykxlqu5ra,"Oi Tabata... boa tarde, querida. Me manda mensagem no privado que eu tenho umas coisas pra conversar. Força guerreira",2024-09-15T18:01:29.712Z,0,0,0,2024-09-15T18:01:29.712Z,superdinossauro.bsky.social,Angel,did:plc:wbztshjyajpj374mkrpjak77
at://did:plc:w3fwnyji4jkk4rhk52unxdwv/app.bsky.feed.post/3l46znplqnf2f,bafyreig6usxirjjvhemmgjvyng5crxabtfhvqc4kokaeni6d2kariqtpla,,2024-09-15T12:50:42.650Z,0,0,0,2024-09-15T12:50:40.810Z,wal2025.bsky.social,Waldemar Vilhena ,did:plc:w3fwnyji4jkk4rhk52unxdwv
at://did:plc:vthawgvxm6kvhbffghouq7oi/app.bsky.feed.post/3l45le66kxe2g,bafyreiecvqjsm72xczkmafeam2qz3uryh2gyo7z76gckiprh43tkmwzrbu,,2024-09-14T23:02:06.867Z,0,0,8,2024-09-14T23:02:06.867Z,paulgrandson.bsky.social,Prof.Paul_Grandson,did:plc:vthawgvxm6kvhbffghouq7oi
at://did:plc:smizrosbjfpm2c64i76ncxws/app.bsky.feed.post/3l45kde3u2s24,bafyreihhcfvokjejt54b2lapuigtnuebqprws4gsozujuilmaashfjfpea,"Você fez o melhor trabalho desta eleição. Independente do seu resultado pessoal, você tirou a possibilidade de mais um picareta e fanfarrão assumir um cargo majoritário em SP. Obrigado",2024-09-14T22:43:46.012Z,0,0,9,2024-09-14T22:43:46.012Z,carlos1fhc.bsky.social,Carlos Santos,did:plc:smizrosbjfpm2c64i76ncxws
at://did:plc:rq7f4umoy6qzu4zatenkyexk/app.bsky.feed.post/3l45mrt6xpy2n,bafyreic755zdrtebnciquhjx3rkcnbzlfz5nnoo4hhy6yx2owljpkovymm,Considero vc hoje a melhor política do Brasil. Precisamos de mais esquerdas igual a vc aqui no Brasil,2024-09-14T23:27:38.628Z,1,0,1,2024-09-14T23:27:38.628Z,marcel91.bsky.social,,did:plc:rq7f4umoy6qzu4zatenkyexk
at://did:plc:qjcbpbavpmyo5mm26ehlv2hu/app.bsky.feed.post/3l46r64y3si2x,bafyreiai7a5bm53pxnju326rbs3apfovjvcuphqvzunbwsn5abqvw3mwpu,👍🏾👏🏾👏🏾👏🏾,2024-09-15T10:18:47.859Z,0,0,0,2024-09-15T10:18:47.859Z,moacirmartins.bsky.social,,did:plc:qjcbpbavpmyo5mm26ehlv2hu
at://did:plc:pxdjr7psc4lmjgkc6zxczhwt/app.bsky.feed.post/3l47ehsqatn2f,bafyreih3ifyqpwsxemesdd4ltyuy64pxstchwox2u7mkxwt25i2j4fccve,"Dá para postar shorts aqui no BS 
Não relaxa o caradecú tem 3 semanas pra virar o jogo",2024-09-15T16:04:13.381Z,0,0,0,2024-09-15T16:04:13.381Z,xavierceci.bsky.social,Xavier ,did:plc:pxdjr7psc4lmjgkc6zxczhwt
at://did:plc:k3d5qb5liv7soqvqgbvxt73y/app.bsky.feed.post/3l45v462mfr2d,bafyreiarr75d7vy5bs72m2c7ieqeykyi5aizzhnxkikx763hjsj55k2c2m,,2024-09-15T01:56:37.789Z,0,0,0,2024-09-15T01:56:37.789Z,heverton1.bsky.social,h. #Tabata4️⃣0️⃣,did:plc:k3d5qb5liv7soqvqgbvxt73y
at://did:plc:imydewextehyjujfq3b36t53/app.bsky.feed.post/3l47iqt3wpb2e,bafyreig56g4a6e5va5kjkuwkpupggjlmiw6wpf4dinx6ze3jeyl5am2isq,Do guri!,2024-09-15T17:20:47.996Z,0,0,0,2024-09-15T17:20:47.996Z,euleilabc.bsky.social,,did:plc:imydewextehyjujfq3b36t53
at://did:plc:f4fpeb4rekwutlp2opeyxxrf/app.bsky.feed.post/3l45lvsduyt24,bafyreiaud5qlaz27p2twdot7i7cvpjbiyiaegwpk7hbiumklomye54an3q,Tabata você é essencial para política! Estou na torcida para você se tornar prefeita de São Paulo.,2024-09-14T23:12:00.597Z,0,0,0,2024-09-14T23:12:00.014Z,rafaelcarneiro1.bsky.social,Rafael Carneiro ,did:plc:f4fpeb4rekwutlp2opeyxxrf
at://did:plc:evnefddcbquw4znveinftgdq/app.bsky.feed.post/3l45kkuysa622,bafyreiaobhkn6z357vq4rfmo44x6wvd5bk3wx524bksawmavefnjknsm24,"SP já elegeu Erundina, Marta e Haddad e a capital votou em peso no Lula nas eleições de 2022, qdo Ciro virou pó.",2024-09-14T22:47:59.697Z,0,0,1,2024-09-14T22:47:59.697Z,johnyjapon.bsky.social,Naekaua,did:plc:evnefddcbquw4znveinftgdq
at://did:plc:ej6rfhwbcqaad2uj5omfiv4b/app.bsky.feed.post/3l45m2omlvx2g,bafyreigxncbixwoukbixvs3q7wvtsue3dtp4fqy6wkrztlazgvfkwaad3y,Tua campanha tá fantástica!,2024-09-14T23:14:43.467Z,0,0,0,2024-09-14T23:14:43.467Z,mikepapa.bsky.social,,did:plc:ej6rfhwbcqaad2uj5omfiv4b
at://did:plc:bkoh4ngy4mpjtd7q3ik5cz7p/app.bsky.feed.post/3l47kxap5cn24,bafyreicsqbc7deepuxe2yrbqenctwaczagqqczhvcdn5l4iqilmxrkk7ky,"😂😂😂😂 Além de competente, também tem bom humor. 

#Tabata40",2024-09-15T18:00:14.080Z,0,0,0,2024-09-15T18:00:14.080Z,elianediniz.bsky.social,ElianeDiniz ,did:plc:bkoh4ngy4mpjtd7q3ik5cz7p
at://did:plc:a3aukvnfqrnn53huke756ltz/app.bsky.feed.post/3l45mdflerf2o,bafyreibthy6f6zkifth23wegsrdje6sjuqpewrqwyojo5s6w3vwgqafz6q,"oglobo.globo.com/politica/ele...
Resultado: Correa e salabert vão afundar juntos. E Engler, Fuad e Tramonte, 2 dos 3 vão pro segundo turno. E a esquerda se estabaca em BH!😅😃",2024-09-14T23:19:31.833Z,0,0,0,2024-09-14T23:19:31.833Z,mimebenetnash.bsky.social,Mime de Benetnash,did:plc:a3aukvnfqrnn53huke756ltz
at://did:plc:h3zyl7h2y5pt4tcmaj5nooax/app.bsky.feed.post/3l45moz55l72k,bafyreia6zumlptoqj5kvdnuwol5puckzmyhny5gchhsyfttecek43w2u54,"Batata, como você se sente tendo votado a favor da reforma da previdência, que obriga tantos brasileiros a trabalharem até a morte, e ainda querer posar de candidata da periferia? Não é muito cinismo?",2024-09-14T23:26:04.863Z,0,0,0,2024-09-14T23:26:04.863Z,brunostp.bsky.social,,did:plc:h3zyl7h2y5pt4tcmaj5nooax
at://did:plc:fqi4jl4q4klkmrchxjjpwmve/app.bsky.feed.post/3l456f233fw2c,bafyreidur3p66l5ixv6zzqew3446vrj2bzuz7tpbrzpi2t6x2tm6wfvbty,Fofa,2024-09-14T19:09:58.344Z,0,0,3,2024-09-14T19:09:58.344Z,neoliberalindo.bsky.social,neo 🌐,did:plc:fqi4jl4q4klkmrchxjjpwmve
at://did:plc:ymtocx7oc23hs2shxfvnbryo/app.bsky.feed.post/3l44im6ppyj2s,bafyreictzejbb7vkrslshai7ub5e2rrdqwfpdbv35kn2eolenml46tdpde,Parabéns pela campanha Tabata!,2024-09-14T12:40:16.349Z,0,0,0,2024-09-14T12:40:16.349Z,gacl93.bsky.social,Gabriel,did:plc:ymtocx7oc23hs2shxfvnbryo
at://did:plc:7hnr3obzpjo4popomzqbja6i/app.bsky.feed.post/3l44iajiqp62j,bafyreicqzwnllfnnrhtjsmk7upugjjsu5rvenbvz52j276zeftauffv56i,"Isso aí Tabata acredite em vc porque ainda dá pra vc chegar no segundo turno. Vc tem carisma e talento a cidade de São Paulo é local que permite viradas históricas, nada está perdido vá em frente, vá as ruas e puxe os votos. ✊",2024-09-14T12:33:44.774Z,0,0,1,2024-09-14T12:33:44.774Z,sabrino14681409.bsky.social,Roxinante Bilau,did:plc:7hnr3obzpjo4popomzqbja6i
at://did:plc:4xj4mlwcl5z3dbyomrrefgy3/app.bsky.feed.post/3l44rme5aqx2x,bafyreig2k3qphcmfuvinex24xs7okdtm6k4u5v6jhw337zln6rvxo4gw5m,"No atual contexto, Tábata é o melhor nome para a Prefeitura de São Paulo, mas o povo paulistano não possui estoque cognitivo para compreender isso.",2024-09-14T15:21:25.419Z,0,0,0,2024-09-14T15:21:25.419Z,emersonsousa.bsky.social,O Irresignado Digitante,did:plc:4xj4mlwcl5z3dbyomrrefgy3
at://did:plc:sjaeyrdcr5ukw4hy5hg2b7no/app.bsky.feed.post/3l43cat6buk2u,bafyreib6o6gmnkwxajadkqqgsgw3ceziuzx4nkq7kan25dlzqn27ymzbke,Está pendurado no Tarcísio.,2024-09-14T01:13:54.394Z,0,0,1,2024-09-14T01:13:53.109Z,petruskas.bsky.social,Lucia Oliveira ,did:plc:sjaeyrdcr5ukw4hy5hg2b7no
at://did:plc:xsp4nxuwx43gzyz6x2hstpsr/app.bsky.feed.post/3l42dkoustx2x,bafyreibumd5e3qfznvogfqbc2ms2jbdg7jiu2shdnjpycysph5brgka7oi,Você é muito fraca. Sem mais.,2024-09-13T16:04:36.897Z,0,0,0,2024-09-13T16:04:36.897Z,edu-bandarra.bsky.social,EduBandarra,did:plc:xsp4nxuwx43gzyz6x2hstpsr
at://did:plc:ruv5npnaff66gsguac7dfdvq/app.bsky.feed.post/3l42ipqt2ra2a,bafyreigbigdzkaoo22ocpfr73rt5bj4uyukqpvywvakkdzadqvk42gexsq,soltar esse aqui nas redes,2024-09-13T17:36:56.265Z,0,1,2,2024-09-13T17:36:56.265Z,gabrielchiarigalle.bsky.social,Gabriel Chiari Galle,did:plc:ruv5npnaff66gsguac7dfdvq
at://did:plc:osgzqmrsr4c6wurvsgspene5/app.bsky.feed.post/3l45dyqhamg2p,bafyreif3yuoxk4aid4snjpjlnfanchfwccskm7fzme2xt4jlg27xafppou,tu sabe q tem o primeiro turno né?,2024-09-14T20:50:27.784Z,0,0,0,2024-09-14T20:50:27.784Z,odavialencar.bsky.social,permanganato de lá ele,did:plc:osgzqmrsr4c6wurvsgspene5
at://did:plc:fvge4bxvclagkt6u25gwioqz/app.bsky.feed.post/3l42dv6akzz2i,bafyreibflkztyc47yv24eh7zjfzqgjcthgxoafnw6icso6ssi3gtqwhshy,Se eu votasse em SP teria meu voto!!👏👏👏,2024-09-13T16:10:29.251Z,0,0,2,2024-09-13T16:10:29.251Z,anmersonbarreto.bsky.social,Anmerson Barreto,did:plc:fvge4bxvclagkt6u25gwioqz
at://did:plc:evnefddcbquw4znveinftgdq/app.bsky.feed.post/3l42ejpdroa2y,bafyreihsyuaekcqnmxdg6kd5oe5f5mlfnqbnc7v3wefrxpoa5n7ivs2vrq,Mas vc continua rechaçando a esquerda,2024-09-13T16:21:58.351Z,1,0,0,2024-09-13T16:21:58.351Z,johnyjapon.bsky.social,Naekaua,did:plc:evnefddcbquw4znveinftgdq
at://did:plc:6mcopfer6kelyqezcc26657q/app.bsky.feed.post/3l433444lif26,bafyreigdjak47puykumqeewjwyx3a6hiyglgxfp6x4qeaktr6jz6unoxva,Voce mentiu na sabatina da Oeste. O TicTok não foi banido dos EUA existe uma determinação proibindo o uso em aparelhos governamentais porque a China estava a usar a rede para espionagem. Procure se informar. É por isto que você não vai ganhar nem para fachineira da prefeitura,2024-09-13T23:05:58.307Z,0,0,0,2024-09-13T23:05:58.307Z,marcotc.bsky.social,,did:plc:6mcopfer6kelyqezcc26657q
at://did:plc:36q2jtd7byzxgquhvwmx5mgk/app.bsky.feed.post/3l42nqz6mum2v,bafyreigngkbh3ly3pdi4x2qiw2koru3xloadvf6kivpl6utwye4kauull4,"Pelo visto havard não ensina estatística, e tão pouco matemática básica",2024-09-13T19:07:07.415Z,0,0,0,2024-09-13T19:07:07.415Z,quasehenrique.bsky.social,Henrique  ◤✠◢  ¹⁸⁹⁸,did:plc:36q2jtd7byzxgquhvwmx5mgk
at://did:plc:rloe3hzqghow36k744oxraxi/app.bsky.feed.post/3l42oxnbbnx2d,bafyreigqghzmuside5icd7ergw2tjebw2nah3oxua5xhwl2agz2qk36oim,Queria o meu de volta…😣,2024-09-13T19:28:43.500Z,0,0,0,2024-09-13T19:28:43.500Z,biabalducci.bsky.social,Bia Balducci ,did:plc:rloe3hzqghow36k744oxraxi
at://did:plc:nrhwauowluznoeqwdhgalr2w/app.bsky.feed.post/3l3yiii4te22p,bafyreiffmkcya2j2qxhjrl2yh5fwr7g6glulprdnb5hwgj7cthwah2bnda,@tabatasp.bsky.social já pode postar vídeos aqui fica a dica,2024-09-12T22:27:31.353Z,0,0,1,2024-09-12T22:27:31.353Z,sidneyoficial23.bsky.social,sidneynayano,did:plc:nrhwauowluznoeqwdhgalr2w
at://did:plc:fofwzezjdjfha7eonrcfvlgs/app.bsky.feed.post/3l3ytwwl7is2c,bafyreid56i7fpwa74vrfimtadl52dukfscke7r2mldy7xpsgposy27d4yy,"Kkkkkkkkkkkkkk tá bommmm, político promete Td em eleição",2024-09-13T01:52:28.433Z,0,0,0,2024-09-13T01:52:28.433Z,marcosvidigal.bsky.social,,did:plc:fofwzezjdjfha7eonrcfvlgs
at://did:plc:e7xczoolvisxjilomq62cfm5/app.bsky.feed.post/3l3zrfmawrz2t,bafyreiej5xuwe4x5l4wzasb3y6geelj5dwrdcpmpanj6r4fubwoyoreama,"bsky.app/profile/oglo...

Palmas para você!",2024-09-13T10:39:40.176Z,0,0,1,2024-09-13T10:39:40.176Z,drigogu.bsky.social,Goo...,did:plc:e7xczoolvisxjilomq62cfm5
at://did:plc:xobd3w36xlar4y75r4v7qakq/app.bsky.feed.post/3l3vvzi2sbp2w,bafyreiakyzhwr2xhlzxymt5sepflnwus3jiuuvhcscprpnldxxc73nfqhq,"ALÔ TABATA!! 

DESISTA E APOIE BOULOS!!!

FAÇA ESSE GESTO DE SABEDORIA E HUMILDADE",2024-09-11T13:28:13.186Z,1,0,1,2024-09-11T13:28:13.186Z,punkspunk.bsky.social,,did:plc:xobd3w36xlar4y75r4v7qakq
at://did:plc:wkdrycec5nz3fe7a6pwp6kms/app.bsky.feed.post/3l3wk3jit232y,bafyreic4aeys6xgvhqx3cgchokirobkleycincnpsz36e4vsivs6px5dou,Sua candidatura só atrapalha o Boulos não cresce e tira votos da esquerda,2024-09-12T03:50:46.183Z,0,0,0,2024-09-12T03:50:46.183Z,tadeusouza.bsky.social,Tady,did:plc:wkdrycec5nz3fe7a6pwp6kms
at://did:plc:wkdrycec5nz3fe7a6pwp6kms/app.bsky.feed.post/3l3wjzwzep22t,bafyreihmfvnaurz23ji4mvsem3inihpbb7pcar4eyuggw2hjsusce7j5ye,"A Tabata não tem chance em São Paulo, vai levar Pablo e Nunes para o segundo turno. Uma Cândida que favorece mais à direita que à esquerda. Não chega a segunda e vai atrapalhar à esquerda de chegar e deixará a disputa entre dois da direita, deveria desistir em favor de Boulos",2024-09-12T03:49:53.244Z,1,0,0,2024-09-12T03:49:53.244Z,tadeusouza.bsky.social,Tady,did:plc:wkdrycec5nz3fe7a6pwp6kms
at://did:plc:wbztshjyajpj374mkrpjak77/app.bsky.feed.post/3l3wysqmjkk2y,bafyreigfhvz34mgdvc4xrzadltlnia34nnwhuutpgnewpw5kcb4qo6q3ta,"Vou de 28, vou de Marçal.

Faz o M

2️⃣8️⃣  Ⓜ️",2024-09-12T08:14:17.682Z,1,0,0,2024-09-12T08:14:17.682Z,superdinossauro.bsky.social,Angel,did:plc:wbztshjyajpj374mkrpjak77
at://did:plc:qmuwuz4buazx75n4e4t3h6wm/app.bsky.feed.post/3l3vqbxk6hw24,bafyreihcsqcppashtzdpjewayigrtosvdfpxgudx6kmsoerpvak6n56xu4,"Mas aí vocÇe está fazendo propaganda para ele, Tabata.

Infelizmente, jogo do tigrinho é o que o povo quer...
Promessa de prosperidade fácil e rápida, sem esforço, basta ter fé.",2024-09-11T20:09:04.895Z,0,0,0,2024-09-11T20:09:04.895Z,simaobacamart.bsky.social,"Prof. Simão Bacamarte-19, D.Sc",did:plc:qmuwuz4buazx75n4e4t3h6wm
at://did:plc:ogfm4uvy6cc7zbii2c7ih76h/app.bsky.feed.post/3l3vpcktskh2n,bafyreifhdktqurheej4krwifyaur3m3myjukaxd7wbyovgj6bmabfvfeze,"O pior é que diante de tantas evidências , muita gente simplesmente não se importa ! É um pesadelo",2024-09-11T19:51:30.953Z,0,0,4,2024-09-11T19:51:30.953Z,joseailton.bsky.social,José Ailton ,did:plc:ogfm4uvy6cc7zbii2c7ih76h
at://did:plc:7hnr3obzpjo4popomzqbja6i/app.bsky.feed.post/3l3vxvddzaz2s,bafyreigwlywyuwfo37iwb56hy5trxa744c5gsdfilflsdrap62riizrxju,O Marçal é o 171 em pessoa. O cara vive pra dar golpes e a cadeia muito em breve vai pegar ele que nem aconteceu com a Deolane,2024-09-11T22:25:10.661Z,0,0,1,2024-09-11T22:25:10.661Z,sabrino14681409.bsky.social,Roxinante Bilau,did:plc:7hnr3obzpjo4popomzqbja6i
at://did:plc:5zlbf6m4swjjvzdfyl2disl7/app.bsky.feed.post/3l3y4yfqryb2y,bafyreig5mourf2pbrqvlx2za3lxketxdjo7zgdpbn7ashwu7gzokk34iha,"Tabata, vim aqui dizer q hj encontrei uma pessoa q falou q ia votar em vc, ai eu a informei q vc votou a favor da mudança na previdência social e contra os trabalhadores e essa pessoa fez moh cara, disse  q n sabia disso e n votaria + em vc. Papo durou 3 min e eu virei o voto. Ela vai de Boulos.",2024-09-12T19:01:40.676Z,0,0,0,2024-09-12T19:01:40.676Z,renan-oa.bsky.social,,did:plc:5zlbf6m4swjjvzdfyl2disl7
at://did:plc:xobd3w36xlar4y75r4v7qakq/app.bsky.feed.post/3l3vw23p2tj2l,bafyreid23j33njwyzk2fllsw7sri4djoayiwubc7yihzfcmi66umnur5zi,"ALÔ TABATA!!
DESISTA E APOIE BOULOS!
FAÇA ESSE GESTO DE SABEDORIA E HUMILDADE",2024-09-11T13:28:33.780Z,0,0,0,2024-09-11T13:28:33.780Z,punkspunk.bsky.social,,did:plc:xobd3w36xlar4y75r4v7qakq
at://did:plc:m3xmr3widp7rvggafph26as6/app.bsky.feed.post/3l3zprb2htr24,bafyreibjm733y4x62frl3h4c6db3xk7ynp562rjjq27ptd5wff27u3sb44,@tabatasp.bsky.social vai apoiar quem no 2° turno?,2024-09-13T10:10:23.160Z,0,0,0,2024-09-13T10:10:23.160Z,oruamrasec.bsky.social,JOGANDOMAU,did:plc:m3xmr3widp7rvggafph26as6
at://did:plc:xwqtxohbscbqbpppdh7xcjz7/app.bsky.feed.post/3l3vhcyrepv2o,bafyreidkn5s3cku5ekmil4274xkeru63ikce3mh2qorqjykjs6jgfu5mci,👏👏👏,2024-09-11T17:28:32.239Z,0,0,0,2024-09-11T17:28:32.239Z,jesamari.bsky.social,,did:plc:xwqtxohbscbqbpppdh7xcjz7
at://did:plc:xobd3w36xlar4y75r4v7qakq/app.bsky.feed.post/3l3vvzroa7h2j,bafyreigxgwgf2hcrf63vi5gvj2cyinv24oyrj6hzqchrh26ixhivfeegrm,"ALÔ TABATA!!
DESISTA E APOIE BOULOS!!!  !
FAÇA ESSE GESTO DE SABEDORIA E HUMILDADE",2024-09-11T13:28:23.263Z,0,0,0,2024-09-11T13:28:23.263Z,punkspunk.bsky.social,,did:plc:xobd3w36xlar4y75r4v7qakq
