uri,cid,text,created_at,reply_count,repost_count,like_count,indexed_at,author_handle,author_display_name,author_did
at://did:plc:7ufq7f6eayiercg6z7o7jnau/app.bsky.feed.post/3l5nnhn2txq24,bafyreia3eajoadgadesuxa2bnb2xmp567mal7zwocblodar5fbqeh6buwu,"Boulos: a conta não fecha!

Alguém entendeu como ele vai rever a Reforma da Previdência e duplicar estradas sem aumentar impostos? 🤡

#Debatedaglobo",2024-10-04T01:47:38.766Z,0,0,1,2024-10-04T01:47:38.766Z,marinahelenabr.com.br,Marina Helena 30,did:plc:7ufq7f6eayiercg6z7o7jnau
at://did:plc:7ufq7f6eayiercg6z7o7jnau/app.bsky.feed.post/3l5nm5clal22b,bafyreihn6vknfzujdbbbkdhkaqjxjdzthlhaujdey5p53g7zhjtf5kkyim,"Por enquanto, nada de novo!
Dobradinha entre os comunistas, discurso vazio da atual gestão… 
Faltou a única candidata com propostas de verdade!

#Debatedaglobo",2024-10-04T01:23:58.481Z,0,1,4,2024-10-04T01:23:58.481Z,marinahelenabr.com.br,Marina Helena 30,did:plc:7ufq7f6eayiercg6z7o7jnau
at://did:plc:7ufq7f6eayiercg6z7o7jnau/app.bsky.feed.post/3l5nls7zteg23,bafyreigaoxyv2piawlq4yk7x36ufkabeeih4b2dalcjpmd4unfsauwh7cu,"Vem assistir o debate comigo?
Estou AO VIVO! 

www.instagram.com/marinahelena...",2024-10-04T01:17:46.806Z,0,0,1,2024-10-04T01:17:46.806Z,marinahelenabr.com.br,Marina Helena 30,did:plc:7ufq7f6eayiercg6z7o7jnau
at://did:plc:7ufq7f6eayiercg6z7o7jnau/app.bsky.feed.post/3l5muq4qjwy2y,bafyreia3hvkhbom6cyxu35co5wurlldtogaals2baiqiwwgdz6prhk24fe,"CENSURA! Mais uma vez, querem calar a minha voz. Globo, do que vocês tem medo?

Marca a @tvglobo.com aqui e vamos exigir uma explicação! 
#Vote30",2024-10-03T18:25:00.773Z,5,2,15,2024-10-03T18:25:00.773Z,marinahelenabr.com.br,Marina Helena 30,did:plc:7ufq7f6eayiercg6z7o7jnau
at://did:plc:7ufq7f6eayiercg6z7o7jnau/app.bsky.feed.post/3l5b4hcxq432v,bafyreic2ixiheqgd4js7p62dljxrfb7yq5mpnqyhbjqlutzlahc3nbkcse,"Muita gente diz que eu sou a mais preparada, mas que não vai votar em mim por causa das pesquisas. Saiba que as pesquisas erram, e erram porque, no final, quem decide é você.

Vote Marina Helena para prefeita de São Paulo. 3️⃣0️⃣✅

#DebateRecord",2024-09-29T02:11:18.728Z,10,0,15,2024-09-29T02:11:18.610Z,marinahelenabr.com.br,Marina Helena 30,did:plc:7ufq7f6eayiercg6z7o7jnau
at://did:plc:7ufq7f6eayiercg6z7o7jnau/app.bsky.feed.post/3l5az5n2nq72q,bafyreifcvscxxtvjb5jkfiztnh4rvvb7ythmgo73qgioolsjo5otpemrba,"Outro ponto fundamental é cuidar da sua segurança, pois, sem segurança, a gente não faz nada. A ideia é triplicar o orçamento da segurança, que hoje só recebe 1 em cada 100 reais. Vamos dobrar o efetivo da GMC, armá-la e treiná-la bem para proteger o nosso maior patrimônio: o cidadão.

#DebateRecord",2024-09-29T01:12:12.454Z,6,0,7,2024-09-29T01:12:12.410Z,marinahelenabr.com.br,Marina Helena 30,did:plc:7ufq7f6eayiercg6z7o7jnau
at://did:plc:7ufq7f6eayiercg6z7o7jnau/app.bsky.feed.post/3l5aydiygc32f,bafyreih4sge3tcbpyygugnxzvvznofed5unuxevxecikjmfmnj5chgh5u4,"Boulos invadiu e depredou prédios públicos. Ele invadiu e quebrou ministérios aqui em São Paulo. Por muito menos, o que ele chama de “terrorista” do 8 de janeiro, gente que escreveu “perdeu, mané” com batom, está longe do convívio dos seus filhos.

#DebateRecord",2024-09-29T00:57:35.755Z,8,1,10,2024-09-29T00:57:35.711Z,marinahelenabr.com.br,Marina Helena 30,did:plc:7ufq7f6eayiercg6z7o7jnau
at://did:plc:7ufq7f6eayiercg6z7o7jnau/app.bsky.feed.post/3l5awsqsd3w2x,bafyreiai3bxts77t6oea2blu4co3ujhwmkwv3vpqtx4zlamyn5rjzs3bpi,"O brasileiro trabalha metade do ano para pagar impostos e não consegue andar com o celular na rua. Se a gente gastar menos dinheiro com parasitas e com a companheirada, vai sobrar dinheiro para cuidar de você e da sua família.

#DebateRecord",2024-09-29T00:30:19.463Z,4,0,5,2024-09-29T00:30:19.463Z,marinahelenabr.com.br,Marina Helena 30,did:plc:7ufq7f6eayiercg6z7o7jnau
at://did:plc:7ufq7f6eayiercg6z7o7jnau/app.bsky.feed.post/3l5awlg3frd2v,bafyreihj7ekhwhdopjjnaz2nypv52md7xzu7q45hnac5meuah3ry434eji,"""Ricardo Nunes, na campanha, gastou 637 mil reais no aluguel de 12 carros de uma empresa estranha. Gostaria que você explicasse isso aos eleitores: como foi usado esse recurso dos nossos impostos?""

#DebateRecord",2024-09-29T00:26:13.590Z,2,0,1,2024-09-29T00:26:13.590Z,marinahelenabr.com.br,Marina Helena 30,did:plc:7ufq7f6eayiercg6z7o7jnau
at://did:plc:7ufq7f6eayiercg6z7o7jnau/app.bsky.feed.post/3l5apvyftgz2y,bafyreihqvprqavriemiuj5jyxwkldcytapuuynpnzfqdfpcz3nb5cnss4a,"Hoje tem debate!

Às 21h, na TV Record.

Quem vai assistir? 🔥

#DebateRecord
youtube.com/live/4fJ9IkBp90A",2024-09-28T22:26:51.436Z,5,0,7,2024-09-28T22:26:51.436Z,marinahelenabr.com.br,Marina Helena 30,did:plc:7ufq7f6eayiercg6z7o7jnau
at://did:plc:7ufq7f6eayiercg6z7o7jnau/app.bsky.feed.post/3l4uii5avk62q,bafyreibg4qbhww3sffa6aajgippdrqm5df5ydg3izlydymyhq3tqelrxhe,"A ideia é tão boa, que quiseram copiar! 

Na minha gestão, quem ficar mais de 30 dias na fila de espera da saúde, receberá um valor para que seja atendido no particular!",2024-09-24T01:41:53.785Z,5,1,12,2024-09-24T01:41:53.785Z,marinahelenabr.com.br,Marina Helena 30,did:plc:7ufq7f6eayiercg6z7o7jnau
at://did:plc:7ufq7f6eayiercg6z7o7jnau/app.bsky.feed.post/3l4uihl7eha27,bafyreidfkzr3iniojpt2p6fe5lrdtzyxnpo5mmpofrixosera4dkcvuqni,"A ideia é tão boa, que quiseram copiar! 

Na minha gestão, quem ficar mais de 30 dias na fila de espera da saúde, receberá um valor para que seja atendido no particular!",2024-09-24T01:41:34.439Z,0,0,5,2024-09-24T01:41:34.439Z,marinahelenabr.com.br,Marina Helena 30,did:plc:7ufq7f6eayiercg6z7o7jnau
at://did:plc:7ufq7f6eayiercg6z7o7jnau/app.bsky.feed.post/3l4ugz34v5y2b,bafyreifvepgv42tmn4tjnyievyszwixwg5mrtmtg76cisfor3fpnf7pqii,É tão difícil para os jornalistas perguntarem sobre São Paulo? #Vote30 #DebateFlow,2024-09-24T01:15:33.940Z,5,2,10,2024-09-24T01:15:33.940Z,marinahelenabr.com.br,Marina Helena 30,did:plc:7ufq7f6eayiercg6z7o7jnau
at://did:plc:7ufq7f6eayiercg6z7o7jnau/app.bsky.feed.post/3l4ufmbumsl2f,bafyreigf3fd2jr3iyqw4heo4rtjrktds3ltc7ve7yiw5piui7me54ere7e,"Precisamos da PORTA DE SAÍDA PARA A CRACOLÂNDIA! 

Gastamos bilhões com organizações, enquanto mais pessoas tornam-se ainda mais dependentes e caminham para longe da recuperação real. 

Tem jeito, acreditem. Basta fazer!",2024-09-24T00:50:31.689Z,5,1,7,2024-09-24T00:50:31.689Z,marinahelenabr.com.br,Marina Helena 30,did:plc:7ufq7f6eayiercg6z7o7jnau
at://did:plc:7ufq7f6eayiercg6z7o7jnau/app.bsky.feed.post/3l4uerzp7tn2m,bafyreicpdpzd7x2zwxncne67s7fns3aktwp4lmexsekyjyzfgbdfx6wrhy,"MÁFIA DOS ALVARÁS!

São Paulo precisa de tecnologia e desburocratização para baixar o custo da moradia da nossa cidade, além de proteger nosso patrimônio histórico e acabar com a farra das “bençãos” de subprefeitos!",2024-09-24T00:35:50.736Z,0,1,7,2024-09-24T00:35:50.736Z,marinahelenabr.com.br,Marina Helena 30,did:plc:7ufq7f6eayiercg6z7o7jnau
at://did:plc:7ufq7f6eayiercg6z7o7jnau/app.bsky.feed.post/3l4udn3rovz2v,bafyreigg77i2stdszqaa7rrd6icvnu64znql3lsmoemdjweydkuo7aao4y,"Paralelamente, criaremos um
marco zero, a partir do qual novas invasões não serão legalizadas.",2024-09-24T00:15:11.451Z,1,0,5,2024-09-24T00:15:11.451Z,marinahelenabr.com.br,Marina Helena 30,did:plc:7ufq7f6eayiercg6z7o7jnau
at://did:plc:7ufq7f6eayiercg6z7o7jnau/app.bsky.feed.post/3l4udmmt7du2g,bafyreibt2ikreebgj2acpq2i4pje4jhm5t2vh6shko4jbvcvj6axwi7ivy,"QUEBRADA COM ESCRITURA 🏠

Dentro do programa nacional de
regularização fundiária, forneceremos títulos de propriedade expressos para habitações sem risco e com propriedade pacificada.",2024-09-24T00:14:55.773Z,1,0,5,2024-09-24T00:14:55.773Z,marinahelenabr.com.br,Marina Helena 30,did:plc:7ufq7f6eayiercg6z7o7jnau
at://did:plc:7ufq7f6eayiercg6z7o7jnau/app.bsky.feed.post/3l4udlpcbvt2f,bafyreibb6sapvqfxzwywhlarsd7tj5o4yqr7bhv6drztz4nl7mmewucl64,"Falar é fácil, fazer que é complicado!

São Paulo precisa de uma revisão total quando o tema é trânsito e urbanismo, já que impactam diretamente o bem-estar, saúde e economia de cada cidadão da nossa cidade.

Já falei sobre a QUEBRADA COM ESCRITURA por aqui, mas se você ainda não sabe, segue o fio 👇🏻",2024-09-24T00:14:24.746Z,1,1,9,2024-09-24T00:14:24.746Z,marinahelenabr.com.br,Marina Helena 30,did:plc:7ufq7f6eayiercg6z7o7jnau
at://did:plc:7ufq7f6eayiercg6z7o7jnau/app.bsky.feed.post/3l4uallcfpj2w,bafyreicmvap7nj5aydbrg6nzfcmvqpeqkyij7a5gqyjg2oy76uwyuuz2u4,Aqui vamos jantar logo mais. 🔥 #DebateFlow,2024-09-23T23:20:38.699Z,1,0,14,2024-09-23T23:20:38.699Z,marinahelenabr.com.br,Marina Helena 30,did:plc:7ufq7f6eayiercg6z7o7jnau
at://did:plc:7ufq7f6eayiercg6z7o7jnau/app.bsky.feed.post/3l4u5jrcsto2n,bafyreigzugi2o2yggg56chdvdwruaqrryq67vbfqn4k2n32avtsinss6xa,"www.youtube.com/live/sBC_PMK...

Estamos no ar! 😉Bora para mais um debate?

#DebatenoFlow",2024-09-23T22:25:57.113Z,0,0,3,2024-09-23T22:25:57.113Z,marinahelenabr.com.br,Marina Helena 30,did:plc:7ufq7f6eayiercg6z7o7jnau
at://did:plc:7ufq7f6eayiercg6z7o7jnau/app.bsky.feed.post/3l4td2xfbqg2g,bafyreihz6l67mbznujv2eqomxage774hhgvkcodcsmnd4bifum4bldfeii,"Bora com mais uma entrevista? 
Te espero hoje, às 14h 🧡👊🏼
#Vote30 

www.youtube.com/watch?v=INSm...",2024-09-23T14:32:23.327Z,1,1,8,2024-09-23T14:32:23.327Z,marinahelenabr.com.br,Marina Helena 30,did:plc:7ufq7f6eayiercg6z7o7jnau
at://did:plc:7ufq7f6eayiercg6z7o7jnau/app.bsky.feed.post/3l4lvymlkgs2b,bafyreieanv3jisojsdi4optwgmelfqxv2ajwxdh3z4ib5vyaubcjkeyoay,"Não adianta dizer que defende a educação e, no fundo, defender sindicato! O que importa, a meta que realmente precisa ser alcançada: a educação do seu filho. Saber que a escola é um lugar de educação e não doutrinação.",2024-09-20T15:49:48.139Z,7,0,16,2024-09-20T15:49:48.139Z,marinahelenabr.com.br,Marina Helena 30,did:plc:7ufq7f6eayiercg6z7o7jnau
at://did:plc:7ufq7f6eayiercg6z7o7jnau/app.bsky.feed.post/3l4ltbzp6qk24,bafyreidoisqzvmudvpyjcnurcxhqqdmcuvfwmnyy2znhzbk5hq7dg7jray,"Boulos diz que haverá relação de respeito com a GCM. Piada!

Apoia saidinha de presos

Apoia o maior ladrão de todos 

Foi em um desfile de escola de samba onde os policiais estavam vestidos de “demônios” 

O paulistano não é bobo e nossa cidade NÃO FICARÁ NAS MÃOS DE QUEM APOIA BANDIDO!

#DebateSBT",2024-09-20T15:01:22.183Z,15,2,19,2024-09-20T15:01:22.183Z,marinahelenabr.com.br,Marina Helena 30,did:plc:7ufq7f6eayiercg6z7o7jnau
at://did:plc:7ufq7f6eayiercg6z7o7jnau/app.bsky.feed.post/3l4lsxfto5c2l,bafyreiakywc3yhisy2zp3vjmivuw2dr32y2tpenwkmsoiiqfakclb2bp6m,"Vale lembrar que o município pior avaliado no BR, rejeitado por 3 em cada 4 cidadãos, é governado pelo PSOL.

Só no gabinete do prefeito, são 662 pessoas contratadas por indicação política. 

Não podemos permitir que esses parasitas assumam São Paulo!

#DebatenoSBT",2024-09-20T14:55:26.318Z,4,1,4,2024-09-20T14:55:26.318Z,marinahelenabr.com.br,Marina Helena 30,did:plc:7ufq7f6eayiercg6z7o7jnau
at://did:plc:7ufq7f6eayiercg6z7o7jnau/app.bsky.feed.post/3l4lsugcj222b,bafyreihteuxt7eiyhkhm6jt22hkcmqqfleahepoklegprr4ngrxzbmwg5a,Uma ideia inovadora para São Paulo? NÃO VOTAR NO PSOL 🤷🏻‍♀️,2024-09-20T14:53:46.139Z,4,2,13,2024-09-20T14:53:46.139Z,marinahelenabr.com.br,Marina Helena 30,did:plc:7ufq7f6eayiercg6z7o7jnau
at://did:plc:7ufq7f6eayiercg6z7o7jnau/app.bsky.feed.post/3l4ls5el2ks2x,bafyreigk6m43ebpmh6aduhggzzsd2op43rgnwejxnwzsic5stein7qrqzq,"MENOS DINHEIRO PARA OS PARASITAS!

É fácil falar, difícil é colocar em prática ações que tirem o dinheiro do bolso desses parasitas e devolva para quem importa: o paulistano",2024-09-20T14:40:52.569Z,3,1,10,2024-09-20T14:40:52.569Z,marinahelenabr.com.br,Marina Helena 30,did:plc:7ufq7f6eayiercg6z7o7jnau
at://did:plc:7ufq7f6eayiercg6z7o7jnau/app.bsky.feed.post/3l4lnf5h6ak2k,bafyreifb6gc5djgafguhdtmakdamn33c43zmzrbdsjtxdmy3atnppyuxwi,"COMEÇA DAQUI A POUCO!

www.youtube.com/watch?v=YIa-...

Estarei ao vivo, no SBT. Bora falar de proposta? 💪🏻",2024-09-20T13:15:44.739Z,2,1,8,2024-09-20T13:15:44.739Z,marinahelenabr.com.br,Marina Helena 30,did:plc:7ufq7f6eayiercg6z7o7jnau
at://did:plc:7ufq7f6eayiercg6z7o7jnau/app.bsky.feed.post/3l4ehblybop2j,bafyreid2ebhcnf7ltnacsqd6sqkirik45rzvxtxplaqhrh6bqcer6d2umi,"Não podemos tolerar esse tipo de comportamento. Datena, desista da candidatura pelo bem da nossa cidade! 
#DebateRedeTV",2024-09-17T16:37:45.092Z,6,2,13,2024-09-17T16:37:45.092Z,marinahelenabr.com.br,Marina Helena 30,did:plc:7ufq7f6eayiercg6z7o7jnau
at://did:plc:7ufq7f6eayiercg6z7o7jnau/app.bsky.feed.post/3l4edbn6u7y2j,bafyreibhzcx4tgsj2gvoohlor653frw6pvmh7quo7noacxmn7zcljkycoe,"
Por isso, é hora de desafogar a saúde paulistana, valorizando o dinheiro do contribuinte e devolvendo com atendimento sério e de qualidade. 

#DebateRedeTV",2024-09-17T15:26:11.391Z,0,0,5,2024-09-17T15:26:11.391Z,marinahelenabr.com.br,Marina Helena 30,did:plc:7ufq7f6eayiercg6z7o7jnau
at://did:plc:7ufq7f6eayiercg6z7o7jnau/app.bsky.feed.post/3l4edbedwel22,bafyreiapd7ssepryj4blqxkastpx3fpuoi52bjmpnwwzgowkbfdhcazqi4,"A saúde de São Paulo TEM JEITO!

O tanto de impostos arrecadados (tomados) de você, trabalhador, deveria pelo menos garantir atendimento médico 

Mas não ❌",2024-09-17T15:26:01.648Z,1,0,9,2024-09-17T15:26:01.648Z,marinahelenabr.com.br,Marina Helena 30,did:plc:7ufq7f6eayiercg6z7o7jnau
at://did:plc:7ufq7f6eayiercg6z7o7jnau/app.bsky.feed.post/3l4e7szataj2l,bafyreidnzuwbuodyqq72wamvx5bba4xsspqbqiho44qsr3ng36e2poel4a,"A proposta TARIFA MAIS BAIXA reduz o custo da tarifa de
ônibus fora dos horários de pico,
para diminuir a lotação do transporte público nos horários de mais cheios, otimizando a utilização dos veículos e da infraestrutura existente.

Proposta para quem mais importa: os trabalhadores! 

#DebateRedeTV",2024-09-17T14:24:19.583Z,3,0,6,2024-09-17T14:24:19.583Z,marinahelenabr.com.br,Marina Helena 30,did:plc:7ufq7f6eayiercg6z7o7jnau
at://did:plc:7ufq7f6eayiercg6z7o7jnau/app.bsky.feed.post/3l4e7sgfymp2g,bafyreiae5axvbhkc6zsll72dwnagimcnqklmm6mzjjaik7lpt77n2h5d5y,"Maldade ou desinformação do jornalista?

Em nenhum momento do meu Plano de Governo falo sobre aumentar a tarifa de ônibus. Mas eu explico 👇🏻",2024-09-17T14:23:59.808Z,3,0,9,2024-09-17T14:23:59.808Z,marinahelenabr.com.br,Marina Helena 30,did:plc:7ufq7f6eayiercg6z7o7jnau
at://did:plc:7ufq7f6eayiercg6z7o7jnau/app.bsky.feed.post/3l4e7a66fgv2i,bafyreihj6aocnisicluobm2tnd7itka2r4stipnslyhk4mi5k6fhuhhi4i,"Candidatos que se agridem ao vivo criticam e questionam porque defendo a LIBERDADE no Brasil…

Sigo, com orgulho, na linha de frente contra a censura. 

#DebateRedeTV",2024-09-17T14:13:47.233Z,0,0,6,2024-09-17T14:13:47.233Z,marinahelenabr.com.br,Marina Helena 30,did:plc:7ufq7f6eayiercg6z7o7jnau
at://did:plc:7ufq7f6eayiercg6z7o7jnau/app.bsky.feed.post/3l4e6l5f76n2o,bafyreicxabsqaph3wjieidw26lo2uexzjhrjlpauy323v4b7gpm7ux3req,"São Paulo merece TRANSPARÊNCIA. 

O debate já começou e eu quero saber: Tabata, quanto você já gastou com jatinho particular?

#DebateRedeTV",2024-09-17T14:02:01.766Z,1,0,8,2024-09-17T14:02:01.766Z,marinahelenabr.com.br,Marina Helena 30,did:plc:7ufq7f6eayiercg6z7o7jnau
at://did:plc:7ufq7f6eayiercg6z7o7jnau/app.bsky.feed.post/3l4e3lz3owf2w,bafyreifp6l2a7ojqqjsbyp6hweths4wgwqu2jtxy2dem6hyqxdfsk6yhnq,"Já vai começar! Debate na Rede TV 🔥

www.youtube.com/live/aq1ci-P...",2024-09-17T13:08:49.646Z,0,1,6,2024-09-17T13:08:49.646Z,marinahelenabr.com.br,Marina Helena 30,did:plc:7ufq7f6eayiercg6z7o7jnau
at://did:plc:7ufq7f6eayiercg6z7o7jnau/app.bsky.feed.post/3l4aitjsyu426,bafyreihc2r2evoefng7qmmx5tszwrhziple52zkhnwc42rtmmk5yyezyge,"Depois dos ataques absurdos desta noite, ficou claro quem tem ou não capacidade para gerir uma cidade como São Paulo. 

Ainda dá tempo, e a escolha é SUA!

#vote30",2024-09-16T02:55:01.279Z,4,1,19,2024-09-16T02:55:01.279Z,marinahelenabr.com.br,Marina Helena 30,did:plc:7ufq7f6eayiercg6z7o7jnau
at://did:plc:7ufq7f6eayiercg6z7o7jnau/app.bsky.feed.post/3l4ahhenqno2w,bafyreifmjrniiljrbvatrersupdxlxj6kls5zkcf545fgxf5vxususy6mq,"Seja fiel (e se controle), Datena! 

#DebateTVCultura",2024-09-16T02:30:19.539Z,4,4,12,2024-09-16T02:30:19.539Z,marinahelenabr.com.br,Marina Helena 30,did:plc:7ufq7f6eayiercg6z7o7jnau
at://did:plc:7ufq7f6eayiercg6z7o7jnau/app.bsky.feed.post/3l4agfacjvp2j,bafyreigmauyj4wvx2l722rqlljxg662fi7sk5fb7eygxk7smitmdmbvkim,"Por isso, tenho propostas que FUNCIONAM e vão melhorar a vida de quem mais precisa: 

👉🏻 QUEBRADA COM ESCRITURA

👉🏻ALUGUEL SOCIAL

👉🏻 QUEBRADA COM ENDEREÇO

Você pode entender melhor cada um no meu Plano de Governo:  marinahelenabr.com.br/wp-content/u...

#DebateTVCultura",2024-09-16T02:11:14.202Z,1,1,3,2024-09-16T02:11:14.202Z,marinahelenabr.com.br,Marina Helena 30,did:plc:7ufq7f6eayiercg6z7o7jnau
at://did:plc:7ufq7f6eayiercg6z7o7jnau/app.bsky.feed.post/3l4agexvkc52x,bafyreicfhj6l55kfkg5db4vqqed4hctsa3ndp53ux3fqewh2woqyuswkpq,"Acabei de citar o exemplo de uma moradora que tem a casa ALAGADA POR ESGOTO sempre que chove! 

➡️ Mais de 2 milhões de pessoas em São Paulo não têm as escrituras de suaS casas e, consequentemente, não têm acesso ao saneamento básico. 

(Continua 👇🏻)",2024-09-16T02:11:04.961Z,2,1,7,2024-09-16T02:11:04.961Z,marinahelenabr.com.br,Marina Helena 30,did:plc:7ufq7f6eayiercg6z7o7jnau
at://did:plc:7ufq7f6eayiercg6z7o7jnau/app.bsky.feed.post/3l4aecreqbo2a,bafyreiayhvu2wxa5weyohiyvuwyzknouh7dwi6ctukhkzlow5hw4c6l3s4,"Não só esforçada, mas a melhor opção para São Paulo. 

Além disso, a ÚNICA com a coragem necessária para pedir o impeachment de Alexandre de Moraes. 

#DebateTVCultura",2024-09-16T01:34:04.249Z,2,1,6,2024-09-16T01:34:04.249Z,marinahelenabr.com.br,Marina Helena 30,did:plc:7ufq7f6eayiercg6z7o7jnau
at://did:plc:7ufq7f6eayiercg6z7o7jnau/app.bsky.feed.post/3l4adbgmuli2a,bafyreihwnr6gmimp7jz2ym5iy2adkrdypwnu4l4wkhrkyipfjf6x2oof7i,"Um debate de PROPOSTAS! 👇🏻

🚨 Defendo uma GCM PRESENTE, BEM TREINADA E ARMADA. Na minha gestão, o bandido ou muda de profissão ou muda de cidade 💪🏻",2024-09-16T01:15:21.069Z,3,2,7,2024-09-16T01:15:21.069Z,marinahelenabr.com.br,Marina Helena 30,did:plc:7ufq7f6eayiercg6z7o7jnau
at://did:plc:7ufq7f6eayiercg6z7o7jnau/app.bsky.feed.post/3l4abou7xo42b,bafyreicybhql2g5yyupnxrj3vtxpzdl4nqthstsr4qb6dnkyda224t5c3u,"Está chegando a hora! Ansiosos para o debate? 

Nos vemos jajá! 

👉🏻 www.youtube.com/watch?v=OmrV...",2024-09-16T00:47:08.685Z,2,1,6,2024-09-16T00:47:08.685Z,marinahelenabr.com.br,Marina Helena 30,did:plc:7ufq7f6eayiercg6z7o7jnau
at://did:plc:7ufq7f6eayiercg6z7o7jnau/app.bsky.feed.post/3l44iso5als2f,bafyreicgr4uo5cprhtiv4gk4ovlxzmjq256dqo2irocqkqqxsevzb25xvm,"O que você perguntaria no meu lugar?

Debate na TV Cultura amanhã, às 22h. 🔥",2024-09-14T12:43:53.730Z,2,1,13,2024-09-14T12:43:53.730Z,marinahelenabr.com.br,Marina Helena 30,did:plc:7ufq7f6eayiercg6z7o7jnau
at://did:plc:7ufq7f6eayiercg6z7o7jnau/app.bsky.feed.post/3l3y2ngx3sk2y,bafyreic7prsj5ww5f7pltlm7fnzkkckxa6whoay2bzopwv33ftzeewnrjm,"Em uma nação livre, a censura não pode ser a resposta para opiniões divergentes. É preciso deixar claro: toda censura começa com a justificativa de proteger, mas acaba tirando o direito de escolha. O preço é o mais alto que podemos pagar: nossa liberdade.

Se nos outros falta coragem, conte comigo.",2024-09-12T18:19:47.366Z,0,3,16,2024-09-12T18:19:47.366Z,marinahelenabr.com.br,Marina Helena 30,did:plc:7ufq7f6eayiercg6z7o7jnau
at://did:plc:7ufq7f6eayiercg6z7o7jnau/app.bsky.feed.post/3l3vtnyy4gx2o,bafyreia25or6b6f4pktm5fygthm2u25doqmqjkvkbbld7kx3msytn5yirm,"🚨 Ei, atenção! Logo mais vou estar AO VIVO no PODCASTRO.

É normal que a cada minuto alguém tenha um celular roubado em São Paulo? 

Vem ver como vamos resolver os principais problemas da cidade.",2024-09-11T21:09:30.292Z,0,1,13,2024-09-11T21:09:30.292Z,marinahelenabr.com.br,Marina Helena 30,did:plc:7ufq7f6eayiercg6z7o7jnau
at://did:plc:7ufq7f6eayiercg6z7o7jnau/app.bsky.feed.post/3l3spxerwtg2a,bafyreib4amhjle3d6slizasqgved5s7rwxuynxuoeciflxtgageqas7piu,,2024-09-10T15:25:10.618Z,0,1,16,2024-09-10T15:25:10.618Z,marinahelenabr.com.br,Marina Helena 30,did:plc:7ufq7f6eayiercg6z7o7jnau
at://did:plc:7ufq7f6eayiercg6z7o7jnau/app.bsky.feed.post/3l3b36whkzc24,bafyreigg5teaoaaaulv7ckoegidxofqkti53fxnraa5tghpbpq6ab4elqq,"Toda mãe com filho na escola pública terá acesso a um ensino de qualidade. Esse é o nosso compromisso com a Educação.

Concorda? 👇",2024-09-03T14:58:20.060Z,1,2,22,2024-09-03T14:58:20.060Z,marinahelenabr.com.br,Marina Helena 30,did:plc:7ufq7f6eayiercg6z7o7jnau
at://did:plc:7ufq7f6eayiercg6z7o7jnau/app.bsky.feed.post/3l3axi2hvfq2v,bafyreigpnxbxntsugldajujknognxgpz7wvgzbtg6imd2vjmiqpaa2ib6e,E fica a pergunta: como as autoridades vão entrar no X para saber quem está no X? 😂,2024-09-03T13:51:51.001Z,3,0,19,2024-09-03T13:51:51.001Z,marinahelenabr.com.br,Marina Helena 30,did:plc:7ufq7f6eayiercg6z7o7jnau
at://did:plc:7ufq7f6eayiercg6z7o7jnau/app.bsky.feed.post/3l36ynh3gwy2v,bafyreibr5hog37pp6vhywxo627t2mzwtdlmkclgqjk7a6knmd7vs6k3nua,"Nós temos coragem para enfrentar o sistema e os abusos de poder. Uma São Paulo mais livre é possível, mas precisamos fazer as nossas ideias chegarem mais longe.

Doe e contribua para a nossa campanha à prefeitura em São Paulo. Mais informações em doa.la/marina-prefe...

Vem de 30🧡🚀",2024-09-02T19:07:25.734Z,3,3,21,2024-09-02T19:07:25.734Z,marinahelenabr.com.br,Marina Helena 30,did:plc:7ufq7f6eayiercg6z7o7jnau
at://did:plc:7ufq7f6eayiercg6z7o7jnau/app.bsky.feed.post/3l36l6blndj2o,bafyreib6lnrvz6n4h7dvmwuwgpjezrxmu5633qwhyzjvzobheukjapaboi,"Tem muita gente que fala, mas não sai do discurso. Vocês podem ter certeza: aqui tem coragem para enfrentar o sistema e os abusos de poder.

Dia 7 de setembro, nos vemos na Paulista.",2024-09-02T15:06:18.718Z,3,3,19,2024-09-02T15:06:18.718Z,marinahelenabr.com.br,Marina Helena 30,did:plc:7ufq7f6eayiercg6z7o7jnau
at://did:plc:7ufq7f6eayiercg6z7o7jnau/app.bsky.feed.post/3l36kv2wyij24,bafyreidq3ienvxwr2o53skoh3xuxtd5lc3yn4oca3evzquvizsmmjvo6re,Chegamos! #vote30 🧡,2024-09-02T15:01:09.604Z,1,1,14,2024-09-02T15:01:09.604Z,marinahelenabr.com.br,Marina Helena 30,did:plc:7ufq7f6eayiercg6z7o7jnau
